main_name,location,id,property_type,price_type,days_on_site,lat,lon,Baños,Estacionamientos,Recámaras,m2_totales,m2_construidos,years,price_final,source,geometry,index_right,CVEGEO,CVE_ENT,CVE_MUN,CVE_LOC,CVE_AGEB,Ambito,new_id,num_comercios,is_consultorio,is_recreativo,is_retail,is_escuela,Baños_imp,Recámaras_imp,num_comercios_imp,is_consultorio_imp,is_recreativo_imp,is_retail_imp,is_escuela_imp,precio_m2,precio_m2_final
hermoso departamento en venta en el corazón de roma norte!,"Tabasco, Roma Norte, Cuauhtémoc, Distrito Federal",1272,depto,venta,10.0,19.4188488,-99.1613324,2.0,2.0,2.0,215.0,215.0,0.0,12900000.0,metros_cubicos,POINT (-99.16133240000001 19.4188488),12699,0901500011002,9,15,1,1002,Urbana,409,284.0,11.0,61.0,69.0,18.0,2.0,2.0,284.0,11.0,61.0,69.0,18.0,60000.0,60000.0
departamento en venta en roma norte  ff  22 - 3114 - 1,"Roma Norte, Cuauhtémoc, Distrito Federal",1278,depto,venta,32.0,19.4195256,-99.162549,2.0,1.0,2.0,125.0,125.0,-1.0,6800018.0,metros_cubicos,POINT (-99.162549 19.4195256),12699,0901500011002,9,15,1,1002,Urbana,410,317.0,17.0,59.0,71.0,15.0,2.0,2.0,317.0,17.0,59.0,71.0,15.0,54400.144,54400.144
departamento en venta en la roma norte super ubicado,"Roma Norte, Cuauhtémoc, Distrito Federal",1282,depto,venta,7.0,19.4195256,-99.162549,2.0,2.0,2.0,90.0,90.0,0.0,5200000.0,metros_cubicos,POINT (-99.162549 19.4195256),12699,0901500011002,9,15,1,1002,Urbana,411,317.0,17.0,59.0,71.0,15.0,2.0,2.0,317.0,17.0,59.0,71.0,15.0,57777.77777777778,57777.77777777778
departamentos de 2 a 3 habs. en venta en colonia roma norte,"Roma Norte, Cuauhtémoc, Distrito Federal",1290,depto,venta,20.0,19.4195256,-99.162549,2.0,,3.0,114.0,114.0,1.0,6620120.0,metros_cubicos,POINT (-99.162549 19.4195256),12699,0901500011002,9,15,1,1002,Urbana,412,317.0,17.0,59.0,71.0,15.0,2.0,3.0,317.0,17.0,59.0,71.0,15.0,58071.228070175435,58071.228070175435
departamento en venta en roma norte frontera 22679ru,"Roma Norte, Cuauhtémoc, Distrito Federal",1294,depto,venta,3.0,19.4195256,-99.162549,1.0,,1.0,60.0,60.0,0.0,3595000.0,metros_cubicos,POINT (-99.162549 19.4195256),12699,0901500011002,9,15,1,1002,Urbana,413,317.0,17.0,59.0,71.0,15.0,1.0,1.0,317.0,17.0,59.0,71.0,15.0,59916.666666666664,59916.666666666664
departamento en venta en cuauhtemoc calle zacatecas 211908rt,"Roma Norte, Cuauhtémoc, Distrito Federal",1295,depto,venta,4.0,19.4195256,-99.162549,2.0,1.0,1.0,74.0,74.0,0.0,4780000.0,metros_cubicos,POINT (-99.162549 19.4195256),12699,0901500011002,9,15,1,1002,Urbana,414,317.0,17.0,59.0,71.0,15.0,2.0,1.0,317.0,17.0,59.0,71.0,15.0,64594.59459459459,64594.59459459459
departamento en venta en cuauhtemoc 211906rt,"Roma Norte, Cuauhtémoc, Distrito Federal",1296,depto,venta,4.0,19.4195256,-99.162549,1.0,1.0,1.0,58.0,58.0,0.0,3780000.0,metros_cubicos,POINT (-99.162549 19.4195256),12699,0901500011002,9,15,1,1002,Urbana,415,317.0,17.0,59.0,71.0,15.0,1.0,1.0,317.0,17.0,59.0,71.0,15.0,65172.41379310345,65172.41379310345
departamento en roma norte  ff  21 - 2489 - 1,"Roma Norte, Cuauhtémoc, Distrito Federal",1298,depto,venta,4.0,19.4195256,-99.162549,1.0,1.0,1.0,39.0,39.0,0.0,2980018.0,metros_cubicos,POINT (-99.162549 19.4195256),12699,0901500011002,9,15,1,1002,Urbana,416,317.0,17.0,59.0,71.0,15.0,1.0,1.0,317.0,17.0,59.0,71.0,15.0,76410.71794871795,76410.71794871795
departamento en venta en roma norte  insurgentes sur cat212490,"Roma Norte, Cuauhtémoc, Distrito Federal",1304,depto,venta,3.0,19.4195256,-99.162549,1.0,1.0,1.0,47.0,47.0,0.0,3715293.0,metros_cubicos,POINT (-99.162549 19.4195256),12699,0901500011002,9,15,1,1002,Urbana,417,317.0,17.0,59.0,71.0,15.0,1.0,1.0,317.0,17.0,59.0,71.0,15.0,79048.78723404255,79048.78723404255
departamento en venta en roma norte san luis potosí 22944rt,"Roma Norte, Cuauhtémoc, Distrito Federal",1306,depto,venta,3.0,19.4195256,-99.162549,2.0,1.0,2.0,110.0,110.0,0.0,7962400.0,metros_cubicos,POINT (-99.162549 19.4195256),12699,0901500011002,9,15,1,1002,Urbana,418,317.0,17.0,59.0,71.0,15.0,2.0,2.0,317.0,17.0,59.0,71.0,15.0,72385.45454545454,72385.45454545454
departamento en venta en roma norte,"Roma Norte, Cuauhtémoc, Distrito Federal",1308,depto,venta,4.0,19.4195256,-99.162549,2.0,1.0,2.0,110.0,110.0,0.0,7962400.0,metros_cubicos,POINT (-99.162549 19.4195256),12699,0901500011002,9,15,1,1002,Urbana,419,317.0,17.0,59.0,71.0,15.0,2.0,2.0,317.0,17.0,59.0,71.0,15.0,72385.45454545454,72385.45454545454
departamento en venta en cuauhtemoc roma norte 211889rt,"Roma Norte, Cuauhtémoc, Distrito Federal",1309,depto,venta,4.0,19.4195256,-99.162549,1.0,1.0,1.0,67.0,67.0,0.0,4600000.0,metros_cubicos,POINT (-99.162549 19.4195256),12699,0901500011002,9,15,1,1002,Urbana,420,317.0,17.0,59.0,71.0,15.0,1.0,1.0,317.0,17.0,59.0,71.0,15.0,68656.71641791044,68656.71641791044
departamento en venta en cuauhtemoc roma norte 211895ru,"Roma Norte, Cuauhtémoc, Distrito Federal",1310,depto,venta,4.0,19.4195256,-99.162549,1.0,1.0,,57.0,57.0,0.0,3950000.0,metros_cubicos,POINT (-99.162549 19.4195256),12699,0901500011002,9,15,1,1002,Urbana,421,317.0,17.0,59.0,71.0,15.0,1.0,1.0,317.0,17.0,59.0,71.0,15.0,69298.24561403508,69298.24561403508
departamento en venta en cuauhtemoc roma norte 211909ru,"Roma Norte, Cuauhtémoc, Distrito Federal",1311,depto,venta,4.0,19.4195256,-99.162549,2.0,1.0,2.0,71.0,71.0,0.0,4790000.0,metros_cubicos,POINT (-99.162549 19.4195256),12699,0901500011002,9,15,1,1002,Urbana,422,317.0,17.0,59.0,71.0,15.0,2.0,2.0,317.0,17.0,59.0,71.0,15.0,67464.78873239437,67464.78873239437
departamento en venta en roma norte 211909rt,"Roma Norte, Cuauhtémoc, Distrito Federal",1312,depto,venta,4.0,19.4195256,-99.162549,2.0,1.0,2.0,71.0,71.0,0.0,4455000.0,metros_cubicos,POINT (-99.162549 19.4195256),12699,0901500011002,9,15,1,1002,Urbana,423,317.0,17.0,59.0,71.0,15.0,2.0,2.0,317.0,17.0,59.0,71.0,15.0,62746.47887323944,62746.47887323944
departamento en venta en cuauhtemoc roma norte oaxaca 212070rt,"Roma Norte, Cuauhtémoc, Distrito Federal",1313,depto,venta,4.0,19.4195256,-99.162549,2.0,,2.0,77.0,77.0,0.0,5875000.0,metros_cubicos,POINT (-99.162549 19.4195256),12699,0901500011002,9,15,1,1002,Urbana,424,317.0,17.0,59.0,71.0,15.0,2.0,2.0,317.0,17.0,59.0,71.0,15.0,76298.7012987013,76298.7012987013
departamento en venta en roma norte   ff   21 - 1374 - 1,"Roma Norte, Cuauhtémoc, Distrito Federal",1314,depto,venta,4.0,19.4195256,-99.162549,3.0,1.0,2.0,193.0,193.0,1.0,9000018.0,metros_cubicos,POINT (-99.162549 19.4195256),12699,0901500011002,9,15,1,1002,Urbana,425,317.0,17.0,59.0,71.0,15.0,3.0,2.0,317.0,17.0,59.0,71.0,15.0,46632.21761658031,46632.21761658031
departamento en venta en roma norte cuauhtemoc 211906ru,"Roma Norte, Cuauhtémoc, Distrito Federal",1324,depto,venta,4.0,19.4195256,-99.162549,1.0,1.0,1.0,57.0,57.0,0.0,4110000.0,metros_cubicos,POINT (-99.162549 19.4195256),12699,0901500011002,9,15,1,1002,Urbana,427,317.0,17.0,59.0,71.0,15.0,1.0,1.0,317.0,17.0,59.0,71.0,15.0,72105.26315789473,72105.26315789473
departamento en venta en roma norte 22679lc,"Roma Norte, Cuauhtémoc, Distrito Federal",1325,depto,venta,4.0,19.4195256,-99.162549,1.0,,1.0,60.0,60.0,0.0,3395000.0,metros_cubicos,POINT (-99.162549 19.4195256),12699,0901500011002,9,15,1,1002,Urbana,428,317.0,17.0,59.0,71.0,15.0,1.0,1.0,317.0,17.0,59.0,71.0,15.0,56583.333333333336,56583.333333333336
departamento en venta en cuauhtemoc roma norte 211906rt,"Roma Norte, Cuauhtémoc, Distrito Federal",1333,depto,venta,4.0,19.4195256,-99.162549,1.0,1.0,1.0,57.0,57.0,7.0,4110000.0,metros_cubicos,POINT (-99.162549 19.4195256),12699,0901500011002,9,15,1,1002,Urbana,430,317.0,17.0,59.0,71.0,15.0,1.0,1.0,317.0,17.0,59.0,71.0,15.0,72105.26315789473,72105.26315789473
departamento en venta en roma norte  ff  21 - 2490 - 1,"Roma Norte, Cuauhtémoc, Distrito Federal",1335,depto,venta,4.0,19.4195256,-99.162549,1.0,1.0,1.0,47.0,47.0,0.0,3715282.0,metros_cubicos,POINT (-99.162549 19.4195256),12699,0901500011002,9,15,1,1002,Urbana,431,317.0,17.0,59.0,71.0,15.0,1.0,1.0,317.0,17.0,59.0,71.0,15.0,79048.55319148937,79048.55319148937
departamento en venta en roma norte 22940rt,"Roma Norte, Cuauhtémoc, Distrito Federal",1339,depto,venta,3.0,19.4195256,-99.162549,1.0,1.0,1.0,60.0,60.0,0.0,4296668.0,metros_cubicos,POINT (-99.162549 19.4195256),12699,0901500011002,9,15,1,1002,Urbana,434,317.0,17.0,59.0,71.0,15.0,1.0,1.0,317.0,17.0,59.0,71.0,15.0,71611.13333333333,71611.13333333333
departamento en venta en roma sur cuauhtemoc 21868ru,"Roma Norte, Cuauhtémoc, Distrito Federal",1342,depto,venta,4.0,19.4195256,-99.162549,3.0,2.0,2.0,126.0,126.0,0.0,8700000.0,metros_cubicos,POINT (-99.162549 19.4195256),12699,0901500011002,9,15,1,1002,Urbana,437,317.0,17.0,59.0,71.0,15.0,3.0,2.0,317.0,17.0,59.0,71.0,15.0,69047.61904761905,69047.61904761905
departamento en venta en roma norte 212489nc,"Roma Norte, Cuauhtémoc, Distrito Federal",1343,depto,venta,4.0,19.4195256,-99.162549,1.0,1.0,1.0,39.0,39.0,0.0,2980000.0,metros_cubicos,POINT (-99.162549 19.4195256),12699,0901500011002,9,15,1,1002,Urbana,438,317.0,17.0,59.0,71.0,15.0,1.0,1.0,317.0,17.0,59.0,71.0,15.0,76410.2564102564,76410.2564102564
gran oportunidad para tu patrimonio en av. oaxaca -ams,"Roma Norte, Ciudad De México, Cdmx, México, Roma Norte, Cuauhtémoc, Distrito Federal",1347,depto,venta,29.0,19.4195256,-99.162549,1.0,1.0,2.0,120.0,120.0,0.0,4100000.0,metros_cubicos,POINT (-99.162549 19.4195256),12699,0901500011002,9,15,1,1002,Urbana,439,317.0,17.0,59.0,71.0,15.0,1.0,2.0,317.0,17.0,59.0,71.0,15.0,34166.666666666664,34166.666666666664
"departamentos a una cuadra de glorieta de los insurgentes y universidad de las americas, puedes unir espacios si lo deseas comprando 2 o más","Insurgentes Sur 179, Roma Norte, Cuauhtémoc, Distrito Federal",1350,depto,venta,6.0,19.419525,-99.162549,1.0,,1.0,39.0,39.0,0.0,3000000.0,metros_cubicos,POINT (-99.162549 19.419525),12699,0901500011002,9,15,1,1002,Urbana,440,317.0,17.0,59.0,71.0,15.0,1.0,1.0,317.0,17.0,59.0,71.0,15.0,76923.07692307692,76923.07692307692
departamento en venta en cuauhtemoc roma norte 22169rt,"Roma Norte, Cuauhtémoc, Distrito Federal",1357,depto,venta,4.0,19.4195256,-99.162549,3.0,1.0,2.0,122.0,122.0,0.0,8400000.0,metros_cubicos,POINT (-99.162549 19.4195256),12699,0901500011002,9,15,1,1002,Urbana,441,317.0,17.0,59.0,71.0,15.0,3.0,2.0,317.0,17.0,59.0,71.0,15.0,68852.45901639345,68852.45901639345
"exterior con buena iluminación, en la roma","Tlacotalpan 0, Roma Norte, Cuauhtémoc, Distrito Federal",1359,depto,renta,8.0,19.4195256,-99.162549,2.0,,3.0,140.0,140.0,40.0,20000.0,metros_cubicos,POINT (-99.162549 19.4195256),12699,0901500011002,9,15,1,1002,Urbana,442,317.0,17.0,59.0,71.0,15.0,2.0,3.0,317.0,17.0,59.0,71.0,15.0,24489.795918367345,24489.795918367345
departamento en venta en roma norte en calle zacatecas 211895,"Roma Norte, Cuauhtémoc, Distrito Federal",1361,depto,venta,4.0,19.4195256,-99.162549,1.0,1.0,1.0,57.0,57.0,0.0,3950000.0,metros_cubicos,POINT (-99.162549 19.4195256),12699,0901500011002,9,15,1,1002,Urbana,443,317.0,17.0,59.0,71.0,15.0,1.0,1.0,317.0,17.0,59.0,71.0,15.0,69298.24561403508,69298.24561403508
"icon roma departamentos a una cuadra de glorieta de los insurgentes y universidad de las americas, puedes unir espacios si lo deseas comprando 2 o más","Insurgentes Sur 179, Roma Norte, Cuauhtémoc, Distrito Federal",1366,depto,venta,3.0,19.419525,-99.162549,1.0,,1.0,39.0,39.0,0.0,3000000.0,metros_cubicos,POINT (-99.162549 19.419525),12699,0901500011002,9,15,1,1002,Urbana,444,317.0,17.0,59.0,71.0,15.0,1.0,1.0,317.0,17.0,59.0,71.0,15.0,76923.07692307692,76923.07692307692
"departamento en venta en avenida chapultepec,roma norte. ru 22-3111 ","Roma Norte, Cuauhtémoc, Distrito Federal",1382,depto,venta,32.0,19.4195256,-99.162549,2.0,1.0,1.0,61.0,61.0,-1.0,4430004.0,metros_cubicos,POINT (-99.162549 19.4195256),12699,0901500011002,9,15,1,1002,Urbana,445,317.0,17.0,59.0,71.0,15.0,2.0,1.0,317.0,17.0,59.0,71.0,15.0,72623.01639344262,72623.01639344262
departamento en venta en roma norte  ff  22 - 3111 - 1,"Roma Norte, Cuauhtémoc, Distrito Federal",1385,depto,venta,32.0,19.4195256,-99.162549,2.0,1.0,1.0,61.0,61.0,-1.0,4430018.0,metros_cubicos,POINT (-99.162549 19.4195256),12699,0901500011002,9,15,1,1002,Urbana,447,317.0,17.0,59.0,71.0,15.0,2.0,1.0,317.0,17.0,59.0,71.0,15.0,72623.24590163934,72623.24590163934
lindo departamento en venta. san luis de potosi . mls 22-944,"Roma Norte, Cuauhtémoc, Distrito Federal",1396,depto,venta,28.0,19.4195256,-99.162549,2.0,1.0,2.0,110.0,110.0,1.0,7962400.0,metros_cubicos,POINT (-99.162549 19.4195256),12699,0901500011002,9,15,1,1002,Urbana,448,317.0,17.0,59.0,71.0,15.0,2.0,2.0,317.0,17.0,59.0,71.0,15.0,72385.45454545454,72385.45454545454
departamento en venta en roma norte  ff  22 - 3107 - 1,"Roma Norte, Cuauhtémoc, Distrito Federal",1399,depto,venta,32.0,19.4195256,-99.162549,2.0,1.0,2.0,86.0,86.0,-1.0,4913518.0,metros_cubicos,POINT (-99.162549 19.4195256),12699,0901500011002,9,15,1,1002,Urbana,449,317.0,17.0,59.0,71.0,15.0,2.0,2.0,317.0,17.0,59.0,71.0,15.0,57133.93023255814,57133.93023255814
departamento en venta en roma norte  ff  21 - 1712 - 1,"Roma Norte, Cuauhtémoc, Distrito Federal",1419,depto,venta,4.0,19.4195256,-99.162549,3.0,2.0,2.0,194.0,194.0,1.0,9350018.0,metros_cubicos,POINT (-99.162549 19.4195256),12699,0901500011002,9,15,1,1002,Urbana,450,317.0,17.0,59.0,71.0,15.0,3.0,2.0,317.0,17.0,59.0,71.0,15.0,48195.969072164946,48195.969072164946
departamento en venta en roma norte durango 22169ru,"Roma Norte, Cuauhtémoc, Distrito Federal",1431,depto,venta,4.0,19.4195256,-99.162549,3.0,1.0,2.0,122.0,122.0,0.0,8400000.0,metros_cubicos,POINT (-99.162549 19.4195256),12699,0901500011002,9,15,1,1002,Urbana,453,317.0,17.0,59.0,71.0,15.0,3.0,2.0,317.0,17.0,59.0,71.0,15.0,68852.45901639345,68852.45901639345
departamento en venta en roma norte 22169al,"Roma Norte, Cuauhtémoc, Distrito Federal",1432,depto,venta,4.0,19.4195256,-99.162549,3.0,1.0,2.0,122.0,122.0,0.0,8400000.0,metros_cubicos,POINT (-99.162549 19.4195256),12699,0901500011002,9,15,1,1002,Urbana,454,317.0,17.0,59.0,71.0,15.0,3.0,2.0,317.0,17.0,59.0,71.0,15.0,68852.45901639345,68852.45901639345
departamento en venta en cuauhtemoc roma norte 211895rt,"Roma Norte, Cuauhtémoc, Distrito Federal",1437,depto,venta,4.0,19.4195256,-99.162549,1.0,1.0,1.0,57.0,57.0,0.0,3640000.0,metros_cubicos,POINT (-99.162549 19.4195256),12699,0901500011002,9,15,1,1002,Urbana,455,317.0,17.0,59.0,71.0,15.0,1.0,1.0,317.0,17.0,59.0,71.0,15.0,63859.649122807015,63859.649122807015
departamento en venta en roma norte cuauhtemoc 211897rt,"Roma Norte, Cuauhtémoc, Distrito Federal",1438,depto,venta,4.0,19.4195256,-99.162549,2.0,1.0,1.0,67.0,67.0,0.0,4278000.0,metros_cubicos,POINT (-99.162549 19.4195256),12699,0901500011002,9,15,1,1002,Urbana,456,317.0,17.0,59.0,71.0,15.0,2.0,1.0,317.0,17.0,59.0,71.0,15.0,63850.746268656716,63850.746268656716
departamento en venta en roma norte 22169nc,"Roma Norte, Cuauhtémoc, Distrito Federal",1439,depto,venta,4.0,19.4195256,-99.162549,3.0,1.0,2.0,122.0,122.0,0.0,8400000.0,metros_cubicos,POINT (-99.162549 19.4195256),12699,0901500011002,9,15,1,1002,Urbana,457,317.0,17.0,59.0,71.0,15.0,3.0,2.0,317.0,17.0,59.0,71.0,15.0,68852.45901639345,68852.45901639345
ph en venta en roma norte,"Roma Norte, Cuauhtémoc, Distrito Federal",1450,depto,venta,3.0,19.4195256,-99.162549,3.0,1.0,3.0,284.0,284.0,0.0,12900000.0,metros_cubicos,POINT (-99.162549 19.4195256),12699,0901500011002,9,15,1,1002,Urbana,458,317.0,17.0,59.0,71.0,15.0,3.0,3.0,317.0,17.0,59.0,71.0,15.0,45422.535211267605,45422.535211267605
espectacular departamento en venta con terraza en colonia ro,"Roma Norte, Cuauhtémoc, Distrito Federal",1454,depto,venta,3.0,19.4195256,-99.162549,1.0,1.0,1.0,69.0,69.0,0.0,5000000.0,metros_cubicos,POINT (-99.162549 19.4195256),12699,0901500011002,9,15,1,1002,Urbana,459,317.0,17.0,59.0,71.0,15.0,1.0,1.0,317.0,17.0,59.0,71.0,15.0,72463.76811594203,72463.76811594203
departamento en venta,"Roma Norte, Cuauhtémoc, Distrito Federal",1455,depto,venta,8.0,19.4217314,-99.160594,1.0,,3.0,156.0,156.0,0.0,5900000.0,metros_cubicos,POINT (-99.160594 19.4217314),12699,0901500011002,9,15,1,1002,Urbana,460,278.0,16.0,47.0,44.0,12.0,1.0,3.0,278.0,16.0,47.0,44.0,12.0,37820.51282051282,37820.51282051282
departamento en venta en roma norte zacatecas 211904ig,"Roma Norte, Cuauhtémoc, Distrito Federal",1469,depto,venta,4.0,19.4195256,-99.162549,1.0,1.0,1.0,57.0,57.0,0.0,3750000.0,metros_cubicos,POINT (-99.162549 19.4195256),12699,0901500011002,9,15,1,1002,Urbana,461,317.0,17.0,59.0,71.0,15.0,1.0,1.0,317.0,17.0,59.0,71.0,15.0,65789.47368421052,65789.47368421052
penthouse en venta en zacatecas roma norte cuauhtemoc 212447rt,"Roma Norte, Cuauhtémoc, Distrito Federal",1475,depto,venta,4.0,19.4195256,-99.162549,3.0,2.0,3.0,284.0,284.0,0.0,14700000.0,metros_cubicos,POINT (-99.162549 19.4195256),12699,0901500011002,9,15,1,1002,Urbana,462,317.0,17.0,59.0,71.0,15.0,3.0,3.0,317.0,17.0,59.0,71.0,15.0,51760.56338028169,51760.56338028169
muy buen departamento en venta  en col. roma norte,"Colima, Roma Norte, Cuauhtémoc, Distrito Federal",1477,depto,venta,10.0,19.4189983,-99.1640265,2.0,1.0,2.0,90.0,90.0,21.0,5800000.0,metros_cubicos,POINT (-99.16402650000001 19.4189983),12699,0901500011002,9,15,1,1002,Urbana,463,302.0,17.0,56.0,68.0,13.0,2.0,2.0,302.0,17.0,56.0,68.0,13.0,64444.444444444445,64444.444444444445
departamento en venta en roma norte zacatecas 211909ig,"Roma Norte, Cuauhtémoc, Distrito Federal",1479,depto,venta,4.0,19.4195256,-99.162549,2.0,1.0,2.0,71.0,71.0,0.0,4455000.0,metros_cubicos,POINT (-99.162549 19.4195256),12699,0901500011002,9,15,1,1002,Urbana,464,317.0,17.0,59.0,71.0,15.0,2.0,2.0,317.0,17.0,59.0,71.0,15.0,62746.47887323944,62746.47887323944
venta de departamento con roof privado roma norte increíble pent house,"Colima 318, Roma Norte, Cuauhtémoc, Distrito Federal",1482,depto,venta,3.0,19.419525,-99.162549,2.0,,2.0,216.0,216.0,0.0,12234650.0,metros_cubicos,POINT (-99.162549 19.419525),12699,0901500011002,9,15,1,1002,Urbana,465,317.0,17.0,59.0,71.0,15.0,2.0,2.0,317.0,17.0,59.0,71.0,15.0,56641.898148148146,56641.898148148146
loft en  roma norte preventa,"Roma Norte, Cuauhtémoc, Distrito Federal",1488,depto,venta,20.0,19.4195256,-99.162549,1.0,1.0,1.0,34.0,34.0,0.0,2785000.0,metros_cubicos,POINT (-99.162549 19.4195256),12699,0901500011002,9,15,1,1002,Urbana,466,317.0,17.0,59.0,71.0,15.0,1.0,1.0,317.0,17.0,59.0,71.0,15.0,81911.76470588235,81911.76470588235
departamento en venta en roma sur tlacotalpan 212373ig,"Roma Norte, Cuauhtémoc, Distrito Federal",1493,depto,venta,4.0,19.4195256,-99.162549,2.0,1.0,2.0,91.0,91.0,0.0,5145000.0,metros_cubicos,POINT (-99.162549 19.4195256),12699,0901500011002,9,15,1,1002,Urbana,467,317.0,17.0,59.0,71.0,15.0,2.0,2.0,317.0,17.0,59.0,71.0,15.0,56538.46153846154,56538.46153846154
departamento en venta en roma norte cuauhtemoc 211905ig,"Roma Norte, Cuauhtémoc, Distrito Federal",1494,depto,venta,4.0,19.4195256,-99.162549,2.0,1.0,2.0,71.0,71.0,0.0,4390000.0,metros_cubicos,POINT (-99.162549 19.4195256),12699,0901500011002,9,15,1,1002,Urbana,468,317.0,17.0,59.0,71.0,15.0,2.0,2.0,317.0,17.0,59.0,71.0,15.0,61830.98591549296,61830.98591549296
departamento en venta en cuauhtémoc roma norte 21-3640ig,"Roma Norte, Cuauhtémoc, Distrito Federal",1495,depto,venta,4.0,19.4195256,-99.162549,1.0,1.0,1.0,37.0,37.0,0.0,3848548.0,metros_cubicos,POINT (-99.162549 19.4195256),12699,0901500011002,9,15,1,1002,Urbana,469,317.0,17.0,59.0,71.0,15.0,1.0,1.0,317.0,17.0,59.0,71.0,15.0,104014.81081081081,104014.81081081081
departamento en venta en roma norte zacatecas 211908ig,"Roma Norte, Cuauhtémoc, Distrito Federal",1511,depto,venta,4.0,19.4195256,-99.162549,2.0,1.0,1.0,74.0,74.0,0.0,4780000.0,metros_cubicos,POINT (-99.162549 19.4195256),12699,0901500011002,9,15,1,1002,Urbana,470,317.0,17.0,59.0,71.0,15.0,2.0,1.0,317.0,17.0,59.0,71.0,15.0,64594.59459459459,64594.59459459459
departamento en venta en de durango roma norte 213640al,"Roma Norte, Cuauhtémoc, Distrito Federal",1513,depto,venta,4.0,19.4195256,-99.162549,1.0,1.0,1.0,37.0,37.0,0.0,3848548.0,metros_cubicos,POINT (-99.162549 19.4195256),12699,0901500011002,9,15,1,1002,Urbana,472,317.0,17.0,59.0,71.0,15.0,1.0,1.0,317.0,17.0,59.0,71.0,15.0,104014.81081081081,104014.81081081081
departamento en venta en roma norte  ff  22 - 2873 - 1,"Roma Norte, Cuauhtémoc, Distrito Federal",1524,depto,venta,38.0,19.4195256,-99.162549,1.0,1.0,1.0,37.0,37.0,1.0,3848582.0,metros_cubicos,POINT (-99.162549 19.4195256),12699,0901500011002,9,15,1,1002,Urbana,475,317.0,17.0,59.0,71.0,15.0,1.0,1.0,317.0,17.0,59.0,71.0,15.0,104015.72972972973,104015.72972972973
departamento en venta en roma sur bajio cat221995,"Roma Norte, Cuauhtémoc, Distrito Federal",1525,depto,venta,2.0,19.4195256,-99.162549,2.0,2.0,3.0,111.0,111.0,0.0,6426000.0,metros_cubicos,POINT (-99.162549 19.4195256),12699,0901500011002,9,15,1,1002,Urbana,476,317.0,17.0,59.0,71.0,15.0,2.0,3.0,317.0,17.0,59.0,71.0,15.0,57891.89189189189,57891.89189189189
departamento en venta en cuauhtemoc roma norte zacatecas 211897ig,"Roma Norte, Cuauhtémoc, Distrito Federal",1529,depto,venta,4.0,19.4195256,-99.162549,2.0,1.0,1.0,67.0,67.0,0.0,4278000.0,metros_cubicos,POINT (-99.162549 19.4195256),12699,0901500011002,9,15,1,1002,Urbana,477,317.0,17.0,59.0,71.0,15.0,2.0,1.0,317.0,17.0,59.0,71.0,15.0,63850.746268656716,63850.746268656716
excelente departamento en av chapultepec,"Av Chapultepec 246, Roma Norte, Cuauhtémoc, Distrito Federal",1553,depto,venta,8.0,19.4239626,-99.1609669,2.0,1.0,2.0,85.0,85.0,8.0,2038000.0,metros_cubicos,POINT (-99.16096690000001 19.4239626),12699,0901500011002,9,15,1,1002,Urbana,483,352.0,11.0,56.0,67.0,12.0,2.0,2.0,352.0,11.0,56.0,67.0,12.0,23976.470588235294,23976.470588235294
venta de departamentos con balcón roma norte apa_2797 rf,"Roma Norte, Ciudad De México, Cdmx, México, Roma Norte, Cuauhtémoc, Distrito Federal",1557,depto,venta,58.0,19.4195256,-99.162549,1.0,1.0,1.0,61.0,58.0,0.0,4030000.0,metros_cubicos,POINT (-99.162549 19.4195256),12699,0901500011002,9,15,1,1002,Urbana,485,317.0,17.0,59.0,71.0,15.0,1.0,1.0,317.0,17.0,59.0,71.0,15.0,66065.5737704918,66065.5737704918
¡¡¡gran departamento lujoso en venta!!!  sf,"Av Chapultepec 246 246, Roma Norte, Cuauhtémoc, Distrito Federal",1563,depto,venta,8.0,19.4239626,-99.1609669,2.0,1.0,2.0,85.0,85.0,0.0,2038000.0,metros_cubicos,POINT (-99.16096690000001 19.4239626),12699,0901500011002,9,15,1,1002,Urbana,486,352.0,11.0,56.0,67.0,12.0,2.0,2.0,352.0,11.0,56.0,67.0,12.0,23976.470588235294,23976.470588235294
"departamento venta zacatecas roma norte pent house,","Zacatecas 0, Roma Norte, Cuauhtémoc, Distrito Federal",1587,depto,venta,6.0,19.4195256,-99.162549,4.0,2.0,3.0,270.0,270.0,0.0,15700000.0,metros_cubicos,POINT (-99.162549 19.4195256),12699,0901500011002,9,15,1,1002,Urbana,487,317.0,17.0,59.0,71.0,15.0,4.0,3.0,317.0,17.0,59.0,71.0,15.0,58148.148148148146,58148.148148148146
departamento en venta en zacatecas roma norte 211895ru,"Roma Norte, Cuauhtémoc, Distrito Federal",1606,depto,venta,4.0,19.4195256,-99.162549,1.0,1.0,1.0,57.0,57.0,0.0,3640000.0,metros_cubicos,POINT (-99.162549 19.4195256),12699,0901500011002,9,15,1,1002,Urbana,489,317.0,17.0,59.0,71.0,15.0,1.0,1.0,317.0,17.0,59.0,71.0,15.0,63859.649122807015,63859.649122807015
departamento en venta en roma norte  ff  22  -  2871 - 1,"Roma Norte, Cuauhtémoc, Distrito Federal",1615,depto,venta,38.0,19.4195256,-99.162549,1.0,1.0,1.0,47.0,47.0,1.0,3715282.0,metros_cubicos,POINT (-99.162549 19.4195256),12699,0901500011002,9,15,1,1002,Urbana,490,317.0,17.0,59.0,71.0,15.0,1.0,1.0,317.0,17.0,59.0,71.0,15.0,79048.55319148937,79048.55319148937
departamento en venta en roma norte calle coahuila cat212364,"Roma Norte, Cuauhtémoc, Distrito Federal",1619,depto,venta,2.0,19.4195256,-99.162549,1.0,1.0,1.0,43.0,43.0,0.0,3370000.0,metros_cubicos,POINT (-99.162549 19.4195256),12699,0901500011002,9,15,1,1002,Urbana,491,317.0,17.0,59.0,71.0,15.0,1.0,1.0,317.0,17.0,59.0,71.0,15.0,78372.09302325582,78372.09302325582
departamento en venta en roma norte de durango cat213640,"Roma Norte, Cuauhtémoc, Distrito Federal",1620,depto,venta,3.0,19.4195256,-99.162549,2.0,2.0,2.0,37.0,37.0,0.0,3848548.0,metros_cubicos,POINT (-99.162549 19.4195256),12699,0901500011002,9,15,1,1002,Urbana,492,317.0,17.0,59.0,71.0,15.0,2.0,2.0,317.0,17.0,59.0,71.0,15.0,104014.81081081081,104014.81081081081
departamento en venta en cuauhtemoc roma norte zacatecas 211889ig,"Roma Norte, Cuauhtémoc, Distrito Federal",1622,depto,venta,4.0,19.4195256,-99.162549,2.0,1.0,1.0,67.0,67.0,0.0,4250000.0,metros_cubicos,POINT (-99.162549 19.4195256),12699,0901500011002,9,15,1,1002,Urbana,493,317.0,17.0,59.0,71.0,15.0,2.0,1.0,317.0,17.0,59.0,71.0,15.0,63432.835820895525,63432.835820895525
departamento en venta en zacatecas roma norte 211891ig,"Roma Norte, Cuauhtémoc, Distrito Federal",1623,depto,venta,4.0,19.4195256,-99.162549,2.0,1.0,1.0,69.0,69.0,0.0,4335000.0,metros_cubicos,POINT (-99.162549 19.4195256),12699,0901500011002,9,15,1,1002,Urbana,494,317.0,17.0,59.0,71.0,15.0,2.0,1.0,317.0,17.0,59.0,71.0,15.0,62826.086956521736,62826.086956521736
departamento en venta en roma norte  ff  22 - 2945 - 1,"Roma Norte, Cuauhtémoc, Distrito Federal",1627,depto,venta,39.0,19.4195256,-99.162549,2.0,1.0,2.0,65.0,65.0,1.0,4330018.0,metros_cubicos,POINT (-99.162549 19.4195256),12699,0901500011002,9,15,1,1002,Urbana,495,317.0,17.0,59.0,71.0,15.0,2.0,2.0,317.0,17.0,59.0,71.0,15.0,66615.66153846154,66615.66153846154
departamento en venta en cuauhtemoc roma norte 211712ru,"Roma Norte, Cuauhtémoc, Distrito Federal",1634,depto,venta,4.0,19.4195256,-99.162549,3.0,2.0,2.0,194.0,194.0,0.0,9350000.0,metros_cubicos,POINT (-99.162549 19.4195256),12699,0901500011002,9,15,1,1002,Urbana,497,317.0,17.0,59.0,71.0,15.0,3.0,2.0,317.0,17.0,59.0,71.0,15.0,48195.87628865979,48195.87628865979
