main_name|subtitle|link|location|price|attributes|id|address|lat|lon|since
Renta Oficina Con Bodega Roma Norte Cuauhtémoc|Oficina en renta|https://inmueble.metroscubicos.com/MLM-1346934242-renta-oficina-con-bodega-roma-norte-cuauhtemoc-_JM#position=12&search_layout=grid&type=item&tracking_id=33ded5de-6d45-4bda-87ed-933aefe68a30|Roma Norte, Cuauhtémoc, Distrito Federal|350 pesos|1,146 m² construidos|1452||19.39068|-99.2836995|Publicado hace 2 meses
Oficinas En Renta, Colonia Roma Norte. Odo-0143|Oficina en renta|https://inmueble.metroscubicos.com/MLM-893283263-oficinas-en-renta-colonia-roma-norte-odo-0143-_JM#position=13&search_layout=grid&type=item&tracking_id=33ded5de-6d45-4bda-87ed-933aefe68a30|Avenida Álvaro Obregón 0, Roma Norte, Cuauhtémoc, Distrito Federal|160000 pesos|570 m² construidos|1453|Avenida Álvaro Obregón 0|19.39068|-99.2836995|Publicado hace 3 años
Espectacular Departamento En Venta Con Terraza En Colonia Ro|Departamento en venta|https://departamento.metroscubicos.com/MLM-1335745606-espectacular-departamento-en-venta-con-terraza-en-colonia-ro-_JM#position=14&search_layout=grid&type=item&tracking_id=33ded5de-6d45-4bda-87ed-933aefe68a30|Roma Norte, Cuauhtémoc, Distrito Federal|5000000 pesos|69 m² construidos,1 rec.|1454||19.39068|-99.2836995|Publicado hace 3 meses
Departamento En Venta|Departamento en venta|https://departamento.metroscubicos.com/MLM-924757041-departamento-en-venta-_JM#position=15&search_layout=grid&type=item&tracking_id=33ded5de-6d45-4bda-87ed-933aefe68a30|Roma Norte, Cuauhtémoc, Distrito Federal|5900000 pesos|156 m² construidos,3 recs.|1455||19.39068|-99.2836995|Publicado hace 8 meses
D1030 - Av. Chapultepec, Roma Norte|Departamento en venta|https://departamento.metroscubicos.com/MLM-1317034341-d1030-av-chapultepec-roma-norte-_JM#position=16&search_layout=grid&type=item&tracking_id=33ded5de-6d45-4bda-87ed-933aefe68a30|Av  Chapultepec, Roma Norte, Cuauhtémoc, Distrito Federal|2752944 pesos|29 m² construidos,1 rec.|1456|Av  Chapultepec|19.39068|-99.2836995|
Consultorio En Renta, Durango Roma Norte Mel|Oficina en renta|https://inmueble.metroscubicos.com/MLM-929821219-consultorio-en-renta-durango-roma-norte-mel-_JM#position=17&search_layout=grid&type=item&tracking_id=33ded5de-6d45-4bda-87ed-933aefe68a30|Durango 1, Roma Norte, Cuauhtémoc, Distrito Federal|14000 pesos|20 m² construidos|1457|Durango 1|19.39068|-99.2836995|Publicado hace 1 año
Departamento En Renta En La Roma Norte|Departamento en venta|https://departamento.metroscubicos.com/MLM-1362501690-departamento-en-renta-en-la-roma-norte-_JM#position=18&search_layout=grid&type=item&tracking_id=33ded5de-6d45-4bda-87ed-933aefe68a30|Cda. Salamanca 14, Roma Norte, Cuauhtémoc, Distrito Federal|3500000 pesos|62 m² construidos,1 rec.|1458|Cda. Salamanca 14|19.39068|-99.2836995|Publicado hace 41 días
Espectacular Pentgarden En Pre-venta, Roma Norte|Departamento en venta|https://departamento.metroscubicos.com/MLM-1336943262-espectacular-pentgarden-en-pre-venta-roma-norte-_JM#position=19&search_layout=grid&type=item&tracking_id=33ded5de-6d45-4bda-87ed-933aefe68a30|Guanajuato, Roma Norte, Cuauhtémoc, Distrito Federal|12000000 pesos|187 m² construidos,2 recs.|1459|Guanajuato|19.39068|-99.2836995|Publicado hace 3 meses
Departamento Venta Roma Norte, Durango|Departamento en venta|https://departamento.metroscubicos.com/MLM-874416180-departamento-venta-roma-norte-durango-_JM#position=20&search_layout=grid&type=item&tracking_id=33ded5de-6d45-4bda-87ed-933aefe68a30|Durango, Roma Norte, Cuauhtémoc, Distrito Federal|4930000 pesos|100 m² construidos,2 recs.|1460|Durango|19.39068|-99.2836995|Publicado hace 1 año
Oportunidad Casa En La Roma Nte Dvt|Casa en venta|https://casa.metroscubicos.com/MLM-1329883903-oportunidad-casa-en-la-roma-nte-dvt-_JM#position=21&search_layout=grid&type=item&tracking_id=33ded5de-6d45-4bda-87ed-933aefe68a30|Queretaro 00, Roma Norte, Cuauhtémoc, Distrito Federal|696207 pesos|450 m² construidos,4 recs.|1461|Queretaro 00|19.39068|-99.2836995|Publicado hace 3 meses
Oficina En Roma Norte, Cuauhtémoc|Oficina en renta|https://inmueble.metroscubicos.com/MLM-1366465808-oficina-en-roma-norte-cuauhtemoc-_JM#position=22&search_layout=grid&type=item&tracking_id=33ded5de-6d45-4bda-87ed-933aefe68a30|Valladolid, Roma Norte, Cuauhtémoc, Distrito Federal|6500 pesos|11 m² construidos|1462|Valladolid|19.39068|-99.2836995|Publicado hace 30 días
En Venta Ph Para Estrenar En La Colonia Roma.|Departamento en venta|https://departamento.metroscubicos.com/MLM-1337411986-en-venta-ph-para-estrenar-en-la-colonia-roma-_JM#position=23&search_layout=grid&type=item&tracking_id=33ded5de-6d45-4bda-87ed-933aefe68a30|Guanajuato 238, Roma Norte, Cuauhtémoc, Distrito Federal|9900000 pesos|199 m² construidos,3 recs.|1463|Guanajuato 238|19.39068|-99.2836995|Publicado hace 3 meses
Departamento En Venta En Colonia Roma Muy Bien Ubicado|Departamento en venta|https://departamento.metroscubicos.com/MLM-1372891466-departamento-en-venta-en-colonia-roma-muy-bien-ubicado-_JM#position=24&search_layout=grid&type=item&tracking_id=33ded5de-6d45-4bda-87ed-933aefe68a30|San Luis Potosi 107, Roma Norte, Cuauhtémoc, Distrito Federal|4299999 pesos|92 m² construidos,2 recs.|1464|San Luis Potosi 107|19.39068|-99.2836995|Publicado hace 3 meses
D1075 - Durango, Roma Norte|Departamento en venta|https://departamento.metroscubicos.com/MLM-1319516756-d1075-durango-roma-norte-_JM#position=25&search_layout=grid&type=item&tracking_id=33ded5de-6d45-4bda-87ed-933aefe68a30|Durango, Roma Norte, Cuauhtémoc, Distrito Federal|3848548 pesos|37 m² construidos,1 rec.|1465|Durango|19.39068|-99.2836995|
Departamento En Roma Norte Mx20-jq5513|Departamento en venta|https://departamento.metroscubicos.com/MLM-1358535393-departamento-en-roma-norte-mx20-jq5513-_JM#position=26&search_layout=grid&type=item&tracking_id=33ded5de-6d45-4bda-87ed-933aefe68a30|Cuauhtémoc, Distrito Federal|1200000 pesos|83 m² construidos,2 recs.|1466||19.39068|-99.2836995|Publicado hace 54 días
Venta Departamento Desarrollo Casa Roma 315|Departamento en venta|https://departamento.metroscubicos.com/MLM-1339461774-venta-departamento-desarrollo-casa-roma-315-_JM#position=27&search_layout=grid&type=item&tracking_id=33ded5de-6d45-4bda-87ed-933aefe68a30|Bajio  315, Roma Norte, Cuauhtémoc, Distrito Federal|6790000 pesos|112 m² construidos,3 recs.|1467|Bajio  315|19.39068|-99.2836995|Publicado hace 3 meses
1camt Excelente Departamento En Venta Atraves De Remate Bancario, Col. Roma Norte, Cuauthemoc, Cdmx,   2 Recmaras, 2 Baños|Departamento en venta|https://departamento.metroscubicos.com/MLM-1369527806-1camt-excelente-departamento-en-venta-atraves-de-remate-bancario-col-roma-norte-cuauthemoc-cdmx-2-recmaras-2-banos-_JM#position=28&search_layout=grid&type=item&tracking_id=33ded5de-6d45-4bda-87ed-933aefe68a30|Calle Querétaro 80, Roma Norte, Ciudad De México, Cdmx, México, Roma Norte, Cuauhtémoc, Distrito Federal|855000 pesos|70 m² construidos,2 recs.|1468|Calle Querétaro 80, Roma Norte, Ciudad De México, Cdmx, México|19.39068|-99.2836995|Publicado hace 20 días
Departamento En Venta En Roma Norte Zacatecas 211904ig|Departamento en venta|https://departamento.metroscubicos.com/MLM-1320611039-departamento-en-venta-en-roma-norte-zacatecas-211904ig-_JM#position=29&search_layout=grid&type=item&tracking_id=33ded5de-6d45-4bda-87ed-933aefe68a30|Roma Norte, Cuauhtémoc, Distrito Federal|3750000 pesos|57 m² construidos,1 rec.|1469||19.39068|-99.2836995|Publicado hace 4 meses
Departamento En Roma Norte Mx21-kn8813|Departamento en venta|https://departamento.metroscubicos.com/MLM-1317754013-departamento-en-roma-norte-mx21-kn8813-_JM#position=30&search_layout=grid&type=item&tracking_id=33ded5de-6d45-4bda-87ed-933aefe68a30|Cuauhtémoc, Distrito Federal|2428000 pesos|90 m² construidos,2 recs.|1470||19.39068|-99.2836995|Publicado hace 4 meses
Roma Norte, Increíble Condominio Horizontal Solo 3 Town Hous|Departamento en venta|https://departamento.metroscubicos.com/MLM-841996276-roma-norte-increible-condominio-horizontal-solo-3-town-hous-_JM#position=31&search_layout=grid&type=item&tracking_id=33ded5de-6d45-4bda-87ed-933aefe68a30|Tabasco, Roma Norte, Cuauhtémoc, Distrito Federal|12660000 pesos|149 m² construidos,2 recs.|1471|Tabasco|19.39068|-99.2836995|
Departamento En Venta Roma Norte Cdmx Cuauhtemoc Ro - Dv21354|Departamento en venta|https://departamento.metroscubicos.com/MLM-1366752806-departamento-en-venta-roma-norte-cdmx-cuauhtemoc-ro-dv21354-_JM#position=32&search_layout=grid&type=item&tracking_id=33ded5de-6d45-4bda-87ed-933aefe68a30|Cuauhtémoc, Distrito Federal|3595001 pesos|60 m² construidos,1 rec.|1472||19.39068|-99.2836995|Publicado hace 29 días
Oficinas En Renta, Medellin / Col. Roma|Oficina en renta|https://inmueble.metroscubicos.com/MLM-1355122787-oficinas-en-renta-medellin-col-roma-_JM#position=33&search_layout=grid&type=item&tracking_id=33ded5de-6d45-4bda-87ed-933aefe68a30|Medellín, Roma Norte, Cuauhtémoc, Distrito Federal|55000 pesos|200 m² construidos|1473|Medellín|19.39068|-99.2836995|Publicado hace 2 meses
Oficina En Renta En La Colonia Roma Norte|Oficina en renta|https://inmueble.metroscubicos.com/MLM-1344829725-oficina-en-renta-en-la-colonia-roma-norte-_JM#position=34&search_layout=grid&type=item&tracking_id=33ded5de-6d45-4bda-87ed-933aefe68a30|Roma Norte, Cuauhtémoc, Distrito Federal|280 pesos|200 m² construidos|1474||19.39068|-99.2836995|Publicado hace 2 meses
Penthouse En Venta En Zacatecas Roma Norte Cuauhtemoc 212447rt|Departamento en venta|https://departamento.metroscubicos.com/MLM-1320604464-penthouse-en-venta-en-zacatecas-roma-norte-cuauhtemoc-212447rt-_JM#position=35&search_layout=grid&type=item&tracking_id=33ded5de-6d45-4bda-87ed-933aefe68a30|Roma Norte, Cuauhtémoc, Distrito Federal|14700000 pesos|284 m² construidos,3 recs.|1475||19.39068|-99.2836995|Publicado hace 4 meses
Se Renta Oficina O Consultorio Colonia Roma|Oficina en renta|https://inmueble.metroscubicos.com/MLM-925302361-se-renta-oficina-o-consultorio-colonia-roma-_JM#position=36&search_layout=grid&type=item&tracking_id=33ded5de-6d45-4bda-87ed-933aefe68a30|Roma Norte, Cuauhtémoc, Distrito Federal|22500 pesos|1 m² construidos|1476||19.39068|-99.2836995|Publicado hace 8 meses
Muy Buen Departamento En Venta  En Col. Roma Norte|Departamento en venta|https://departamento.metroscubicos.com/MLM-1343478246-muy-buen-departamento-en-venta-en-col-roma-norte-_JM#position=37&search_layout=grid&type=item&tracking_id=33ded5de-6d45-4bda-87ed-933aefe68a30|Colima, Roma Norte, Cuauhtémoc, Distrito Federal|5800000 pesos|90 m² construidos,2 recs.|1477|Colima|19.39068|-99.2836995|Publicado hace 10 meses
Tz Excelente Oficina En Renta En Roma Norte (1226)|Oficina en renta|https://inmueble.metroscubicos.com/MLM-1371692973-tz-excelente-oficina-en-renta-en-roma-norte-1226-_JM#position=38&search_layout=grid&type=item&tracking_id=33ded5de-6d45-4bda-87ed-933aefe68a30|Valladolid 1 - 300, Roma Norte, Ciudad De México, Cdmx, México, Roma Norte, Cuauhtémoc, Distrito Federal|12000 pesos|24 m² construidos|1478|Valladolid 1 - 300, Roma Norte, Ciudad De México, Cdmx, México|19.39068|-99.2836995|Publicado hace 16 días
Departamento En Venta En Roma Norte Zacatecas 211909ig|Departamento en venta|https://departamento.metroscubicos.com/MLM-1320585358-departamento-en-venta-en-roma-norte-zacatecas-211909ig-_JM#position=39&search_layout=grid&type=item&tracking_id=33ded5de-6d45-4bda-87ed-933aefe68a30|Roma Norte, Cuauhtémoc, Distrito Federal|4455000 pesos|71 m² construidos,2 recs.|1479||19.39068|-99.2836995|Publicado hace 4 meses
Querétaro 37  / Roma Norte|Departamento en venta|https://departamento.metroscubicos.com/MLM-1367136382-queretaro-37-roma-norte-_JM#position=40&search_layout=grid&type=item&tracking_id=33ded5de-6d45-4bda-87ed-933aefe68a30|Queretaro, Roma Norte, Cuauhtémoc, Distrito Federal|3225000 pesos|45 m² construidos,1 rec.|1480|Queretaro|19.39068|-99.2836995|Publicado hace 28 días
Departamento En Roma Norte, Cuauhtémoc|Departamento en venta|https://departamento.metroscubicos.com/MLM-1361697673-departamento-en-roma-norte-cuauhtemoc-_JM#position=41&search_layout=grid&type=item&tracking_id=33ded5de-6d45-4bda-87ed-933aefe68a30|Av Chapultepec 322, Roma Norte, Cuauhtémoc, Distrito Federal|4445000 pesos|85 m² construidos,2 recs.|1481|Av Chapultepec 322|19.39068|-99.2836995|Publicado hace 43 días
Venta De Departamento Con Roof Privado Roma Norte Increíble Pent House|Departamento en venta|https://departamento.metroscubicos.com/MLM-1336888758-venta-de-departamento-con-roof-privado-roma-norte-increible-pent-house-_JM#position=42&search_layout=grid&type=item&tracking_id=33ded5de-6d45-4bda-87ed-933aefe68a30|Colima 318, Roma Norte, Cuauhtémoc, Distrito Federal|12234650 pesos|216 m² construidos,2 recs.|1482|Colima 318|19.39068|-99.2836995|Publicado hace 3 meses
Roma Norte, Departamento Remate , Cuauhtémoc ,cdmx|Departamento en venta|https://departamento.metroscubicos.com/MLM-1313114297-roma-norte-departamento-remate-cuauhtemoc-cdmx-_JM#position=43&search_layout=grid&type=item&tracking_id=33ded5de-6d45-4bda-87ed-933aefe68a30|Medellin, Roma Norte, Cuauhtémoc, Distrito Federal|2250000 pesos|68 m² construidos,2 recs.|1483|Medellin|19.39068|-99.2836995|Publicado hace 4 meses
Oficina Amueblada En Roma Norte De 10 M2 En Renta|Oficina en renta|https://inmueble.metroscubicos.com/MLM-949434776-oficina-amueblada-en-roma-norte-de-10-m2-en-renta-_JM#position=44&search_layout=grid&type=item&tracking_id=33ded5de-6d45-4bda-87ed-933aefe68a30|Puebla, Roma Norte, Cuauhtémoc, Distrito Federal|16000 pesos|15 m² construidos|1484|Puebla|19.39068|-99.2836995|Publicado hace 7 meses
San Luis Potosí Roma Norte|Departamento en venta|https://departamento.metroscubicos.com/MLM-1317108931-san-luis-potosi-roma-norte-_JM#position=45&search_layout=grid&type=item&tracking_id=33ded5de-6d45-4bda-87ed-933aefe68a30|San Luis Potosí, Roma Norte, Cuauhtémoc, Distrito Federal|6853000 pesos|96 m² construidos,2 recs.|1485|San Luis Potosí|19.39068|-99.2836995|
D255 - Guanajuato, Roma Norte|Departamento en venta|https://departamento.metroscubicos.com/MLM-1317107146-d255-guanajuato-roma-norte-_JM#position=46&search_layout=grid&type=item&tracking_id=33ded5de-6d45-4bda-87ed-933aefe68a30|Guanajuato, Roma Norte, Cuauhtémoc, Distrito Federal|10400000 pesos|149 m² construidos,3 recs.|1486|Guanajuato|19.39068|-99.2836995|
Traspaso De Local Comercial Con Excelente Ubicación Dentro Del Mercado Roma Norte|Local comercial en traspaso|https://inmueble.metroscubicos.com/MLM-1370141225-traspaso-de-local-comercial-con-excelente-ubicacion-dentro-del-mercado-roma-norte-_JM#position=47&search_layout=grid&type=item&tracking_id=33ded5de-6d45-4bda-87ed-933aefe68a30|Calle Querétaro 225, Roma Nte., 06700 Ciudad De México, Cdmx, México, Roma Norte, Cuauhtémoc, Distrito Federal|230000 pesos|22 m² construidos|1487|Calle Querétaro 225, Roma Nte., 06700 Ciudad De México, Cdmx, México|19.39068|-99.2836995|Publicado hace 20 días
Loft En  Roma Norte Preventa|Departamento en venta|https://departamento.metroscubicos.com/MLM-1370007873-loft-en-roma-norte-preventa-_JM#position=48&search_layout=grid&type=item&tracking_id=33ded5de-6d45-4bda-87ed-933aefe68a30|Roma Norte, Cuauhtémoc, Distrito Federal|2785000 pesos|34 m² construidos,1 rec.|1488||19.39068|-99.2836995|Publicado hace 20 días
Bonito Departamento En Venta. Andador Adolfo Ruiz. Mls 22-942|Departamento en venta|https://departamento.metroscubicos.com/MLM-1366938368-bonito-departamento-en-venta-andador-adolfo-ruiz-mls-22-942-_JM#position=1&search_layout=grid&type=item&tracking_id=b1ff9b1d-a969-4178-9c4e-488aa19984bd|Roma Norte, Cuauhtémoc, Distrito Federal|8026715 pesos|111 m² construidos,2 recs.|1489||19.39068|-99.2836995|Publicado hace 28 días
Bonito Departamento En Venta. San Luis De Potosi. Mls 22-946|Departamento en venta|https://departamento.metroscubicos.com/MLM-1367022014-bonito-departamento-en-venta-san-luis-de-potosi-mls-22-946-_JM#position=2&search_layout=grid&type=item&tracking_id=b1ff9b1d-a969-4178-9c4e-488aa19984bd|Roma Norte, Cuauhtémoc, Distrito Federal|5090055 pesos|60 m² construidos,1 rec.|1490||19.39068|-99.2836995|Publicado hace 28 días
Bonito Departamento En Venta. San Luis De Potosi. Mls 22-943|Departamento en venta|https://departamento.metroscubicos.com/MLM-1367015272-bonito-departamento-en-venta-san-luis-de-potosi-mls-22-943-_JM#position=3&search_layout=grid&type=item&tracking_id=b1ff9b1d-a969-4178-9c4e-488aa19984bd|Roma Norte, Cuauhtémoc, Distrito Federal|4492244 pesos|60 m² construidos,1 rec.|1491||19.39068|-99.2836995|Publicado hace 28 días
Departamento En Venta Roma Norte, Calle De Durango 21-3640. Nc|Departamento en venta|https://departamento.metroscubicos.com/MLM-1340315178-departamento-en-venta-roma-norte-calle-de-durango-21-3640-nc-_JM#position=4&search_layout=grid&type=item&tracking_id=b1ff9b1d-a969-4178-9c4e-488aa19984bd|Roma Norte, Cuauhtémoc, Distrito Federal|3848545 pesos|37 m² construidos,1 rec.|1492||19.39068|-99.2836995|Publicado hace 3 meses
Departamento En Venta En Roma Sur Tlacotalpan 212373ig|Departamento en venta|https://departamento.metroscubicos.com/MLM-1320585403-departamento-en-venta-en-roma-sur-tlacotalpan-212373ig-_JM#position=5&search_layout=grid&type=item&tracking_id=b1ff9b1d-a969-4178-9c4e-488aa19984bd|Roma Norte, Cuauhtémoc, Distrito Federal|5145000 pesos|91 m² construidos,2 recs.|1493||19.39068|-99.2836995|Publicado hace 4 meses
Departamento En Venta En Roma Norte Cuauhtemoc 211905ig|Departamento en venta|https://departamento.metroscubicos.com/MLM-1320604585-departamento-en-venta-en-roma-norte-cuauhtemoc-211905ig-_JM#position=6&search_layout=grid&type=item&tracking_id=b1ff9b1d-a969-4178-9c4e-488aa19984bd|Roma Norte, Cuauhtémoc, Distrito Federal|4390000 pesos|71 m² construidos,2 recs.|1494||19.39068|-99.2836995|Publicado hace 4 meses
Departamento En Venta En Cuauhtémoc Roma Norte 21-3640ig|Departamento en venta|https://departamento.metroscubicos.com/MLM-1320610335-departamento-en-venta-en-cuauhtemoc-roma-norte-21-3640ig-_JM#position=7&search_layout=grid&type=item&tracking_id=b1ff9b1d-a969-4178-9c4e-488aa19984bd|Roma Norte, Cuauhtémoc, Distrito Federal|3848548 pesos|37 m² construidos,1 rec.|1495||19.39068|-99.2836995|Publicado hace 4 meses
Departamento En Venta En Roma Norte Calle Cordoba 21-2983|Departamento en venta|https://departamento.metroscubicos.com/MLM-1320524254-departamento-en-venta-en-roma-norte-calle-cordoba-21-2983-_JM#position=8&search_layout=grid&type=item&tracking_id=b1ff9b1d-a969-4178-9c4e-488aa19984bd|Roma Norte, Cuauhtémoc, Distrito Federal|4826900 pesos|78 m² construidos,2 recs.|1496||19.39068|-99.2836995|Publicado hace 4 meses
Departamento En Remate, Medellin, Roma Norte, Cuauhtemoc|Departamento en venta|https://departamento.metroscubicos.com/MLM-1317715329-departamento-en-remate-medellin-roma-norte-cuauhtemoc-_JM#position=9&search_layout=grid&type=item&tracking_id=b1ff9b1d-a969-4178-9c4e-488aa19984bd|Cuauhtémoc, Distrito Federal|2300000 pesos|75 m² construidos,2 recs.|1497||19.39068|-99.2836995|Publicado hace 4 meses
Oficina Amueblada En Roma Norte De 20 M2 En Renta|Oficina en renta|https://inmueble.metroscubicos.com/MLM-949428630-oficina-amueblada-en-roma-norte-de-20-m2-en-renta-_JM#position=10&search_layout=grid&type=item&tracking_id=b1ff9b1d-a969-4178-9c4e-488aa19984bd|Puebla, Roma Norte, Cuauhtémoc, Distrito Federal|35000 pesos|20 m² construidos|1498|Puebla|19.39068|-99.2836995|Publicado hace 7 meses
Oficina Amueblada En Roma Norte De 28 M2 En Renta|Oficina en renta|https://inmueble.metroscubicos.com/MLM-949438092-oficina-amueblada-en-roma-norte-de-28-m2-en-renta-_JM#position=11&search_layout=grid&type=item&tracking_id=b1ff9b1d-a969-4178-9c4e-488aa19984bd|Puebla, Roma Norte, Cuauhtémoc, Distrito Federal|49000 pesos|28 m² construidos|1499|Puebla|19.39068|-99.2836995|Publicado hace 7 meses
Oficina En Piso 5 En Renta, Roma Norte, Cuauhtémoc|Oficina en renta|https://inmueble.metroscubicos.com/MLM-924752639-oficina-en-piso-5-en-renta-roma-norte-cuauhtemoc-_JM#position=12&search_layout=grid&type=item&tracking_id=b1ff9b1d-a969-4178-9c4e-488aa19984bd|Roma Norte, Cuauhtémoc, Distrito Federal|38130 pesos|123 m² construidos|1500||19.39068|-99.2836995|Publicado hace 8 meses
Roma Norte, Increíble Condominio Horizontal Solo 3 Pent Hous|Departamento en venta|https://departamento.metroscubicos.com/MLM-841998856-roma-norte-increible-condominio-horizontal-solo-3-pent-hous-_JM#position=13&search_layout=grid&type=item&tracking_id=b1ff9b1d-a969-4178-9c4e-488aa19984bd|Tabasco, Roma Norte, Cuauhtémoc, Distrito Federal|14345000 pesos|185 m² construidos,2 recs.|1501|Tabasco|19.39068|-99.2836995|
D079 - Querétaro 240, Roma Norte|Departamento en venta|https://departamento.metroscubicos.com/MLM-1317122637-d079-queretaro-240-roma-norte-_JM#position=14&search_layout=grid&type=item&tracking_id=b1ff9b1d-a969-4178-9c4e-488aa19984bd|Querétaro, Roma Norte, Cuauhtémoc, Distrito Federal|8000000 pesos|135 m² construidos,3 recs.|1502|Querétaro|19.39068|-99.2836995|
Departamento En Venta Roma Norte|Departamento en venta|https://departamento.metroscubicos.com/MLM-1373196519-departamento-en-venta-roma-norte-_JM#position=15&search_layout=grid&type=item&tracking_id=b1ff9b1d-a969-4178-9c4e-488aa19984bd|Durando193, Roma Norte, Cuauhtémoc, Distrito Federal|3848548 pesos|36 m² construidos,1 rec.|1503|Durando193|19.39068|-99.2836995|Publicado hace 13 días
Local Comercial En Renta, Cuauhtémoc, Ciudad De México|Local comercial en renta|https://inmueble.metroscubicos.com/MLM-1371024618-local-comercial-en-renta-cuauhtemoc-ciudad-de-mexico-_JM#position=16&search_layout=grid&type=item&tracking_id=b1ff9b1d-a969-4178-9c4e-488aa19984bd|Colima, Roma Norte, Cuauhtémoc, Distrito Federal|54345 pesos|110 m² construidos|1504|Colima|19.39068|-99.2836995|Publicado hace 18 días
Departamento En Venta Col.roma Norte|Departamento en venta|https://departamento.metroscubicos.com/MLM-1369493756-departamento-en-venta-colroma-norte-_JM#position=17&search_layout=grid&type=item&tracking_id=b1ff9b1d-a969-4178-9c4e-488aa19984bd|Queretaro, Roma Norte, Cuauhtémoc, Distrito Federal|6700000 pesos|167 m² construidos,3 recs.|1505|Queretaro|19.39068|-99.2836995|Publicado hace 21 días
Increible Departamento En Venta. San Luis De Potosi. Mls 22-939|Departamento en venta|https://departamento.metroscubicos.com/MLM-1366938548-increible-departamento-en-venta-san-luis-de-potosi-mls-22-939-_JM#position=18&search_layout=grid&type=item&tracking_id=b1ff9b1d-a969-4178-9c4e-488aa19984bd|Roma Norte, Cuauhtémoc, Distrito Federal|7904170 pesos|111 m² construidos,2 recs.|1506||19.39068|-99.2836995|Publicado hace 28 días
Bonito Departamento En Venta. Andador Adolfo Ruiz. Mls 22-940|Departamento en venta|https://departamento.metroscubicos.com/MLM-1367002903-bonito-departamento-en-venta-andador-adolfo-ruiz-mls-22-940-_JM#position=19&search_layout=grid&type=item&tracking_id=b1ff9b1d-a969-4178-9c4e-488aa19984bd|Roma Norte, Cuauhtémoc, Distrito Federal|4296668 pesos|60 m² construidos,1 rec.|1507||19.39068|-99.2836995|Publicado hace 28 días
Departamento En Venta Calle De Durango,roma Norte. Ru 21-3640|Departamento en venta|https://departamento.metroscubicos.com/MLM-1353194381-departamento-en-venta-calle-de-durangoroma-norte-ru-21-3640-_JM#position=20&search_layout=grid&type=item&tracking_id=b1ff9b1d-a969-4178-9c4e-488aa19984bd|Roma Norte, Cuauhtémoc, Distrito Federal|3848544 pesos|37 m² construidos,1 rec.|1508||19.39068|-99.2836995|Publicado hace 2 meses
Oportunidad De Inmueble En Roma Norte|Departamento en venta|https://departamento.metroscubicos.com/MLM-1348593533-oportunidad-de-inmueble-en-roma-norte-_JM#position=21&search_layout=grid&type=item&tracking_id=b1ff9b1d-a969-4178-9c4e-488aa19984bd|Cuauhtémoc, Distrito Federal|3240000 pesos|70 m² construidos,2 recs.|1509||19.39068|-99.2836995|Publicado hace 2 meses
Departamento En Venta En Roma Norte, Con Amenidades|Departamento en venta|https://departamento.metroscubicos.com/MLM-1326133694-departamento-en-venta-en-roma-norte-con-amenidades-_JM#position=22&search_layout=grid&type=item&tracking_id=b1ff9b1d-a969-4178-9c4e-488aa19984bd|Roma Norte, Cuauhtémoc, Distrito Federal|3269750 pesos|41 m² construidos,1 rec.|1510||19.39068|-99.2836995|Publicado hace 4 meses
Departamento En Venta En Roma Norte Zacatecas 211908ig|Departamento en venta|https://departamento.metroscubicos.com/MLM-1320604582-departamento-en-venta-en-roma-norte-zacatecas-211908ig-_JM#position=23&search_layout=grid&type=item&tracking_id=b1ff9b1d-a969-4178-9c4e-488aa19984bd|Roma Norte, Cuauhtémoc, Distrito Federal|4780000 pesos|74 m² construidos,1 rec.|1511||19.39068|-99.2836995|Publicado hace 4 meses
Departamento En Venta En Roma Norte|Departamento en venta|https://departamento.metroscubicos.com/MLM-1320525350-departamento-en-venta-en-roma-norte-_JM#position=24&search_layout=grid&type=item&tracking_id=b1ff9b1d-a969-4178-9c4e-488aa19984bd|Roma Norte, Cuauhtémoc, Distrito Federal|2980000 pesos|39 m² construidos,1 rec.|1512||19.39068|-99.2836995|Publicado hace 4 meses
Departamento En Venta En De Durango Roma Norte 213640al|Departamento en venta|https://departamento.metroscubicos.com/MLM-1320530725-departamento-en-venta-en-de-durango-roma-norte-213640al-_JM#position=25&search_layout=grid&type=item&tracking_id=b1ff9b1d-a969-4178-9c4e-488aa19984bd|Roma Norte, Cuauhtémoc, Distrito Federal|3848548 pesos|37 m² construidos,1 rec.|1513||19.39068|-99.2836995|Publicado hace 4 meses
Oficinas En Renta A Media Cuadra De La Fuente De Las Cibeles|Oficina en renta|https://inmueble.metroscubicos.com/MLM-942048348-oficinas-en-renta-a-media-cuadra-de-la-fuente-de-las-cibeles-_JM#position=26&search_layout=grid&type=item&tracking_id=b1ff9b1d-a969-4178-9c4e-488aa19984bd|Av Oaxaca, Roma Norte, Cuauhtémoc, Distrito Federal|42000 pesos|72 m² construidos|1514|Av Oaxaca|19.39068|-99.2836995|
