main_name|subtitle|link|location|price|attributes|id|address|lat|lon|since
Rento Loft Exterior Con Electrodomésticos De Una Recamara Para Estrenar En Roma Norte|Departamento en renta|https://departamento.metroscubicos.com/MLM-1337379039-rento-loft-exterior-con-electrodomesticos-de-una-recamara-para-estrenar-en-roma-norte-_JM#position=20&search_layout=grid&type=item&tracking_id=fa6d12ed-e3f6-4ef1-85de-675f480b9660|Córdoba 229, Roma Norte, Cuauhtémoc, Distrito Federal|19500 pesos|51 m² construidos,1 rec.|500|Córdoba 229|19.39068|-99.2836995|Publicado hace 3 meses
Se Renta Oficina Todo Incluido En Av. Chapultpec|Oficina en renta|https://inmueble.metroscubicos.com/MLM-1321728679-se-renta-oficina-todo-incluido-en-av-chapultpec-_JM#position=21&search_layout=grid&type=item&tracking_id=fa6d12ed-e3f6-4ef1-85de-675f480b9660|Roma Norte, Cuauhtémoc, Distrito Federal|12000 pesos|1 m² construidos|501||19.39068|-99.2836995|Publicado hace 4 meses
Departamento En Venta En Roma Norte|Departamento en venta|https://departamento.metroscubicos.com/MLM-833490296-departamento-en-venta-en-roma-norte-_JM#position=22&search_layout=grid&type=item&tracking_id=fa6d12ed-e3f6-4ef1-85de-675f480b9660|Medellin, Roma Norte, Cuauhtémoc, Distrito Federal|7300000 pesos|180 m² construidos,2 recs.|502|Medellin|19.39068|-99.2836995|Publicado hace 1 año
Departamentos En Preventa Colonia Roma|Departamento en venta|https://departamento.metroscubicos.com/MLM-1350614360-departamentos-en-preventa-colonia-roma-_JM#position=23&search_layout=grid&type=item&tracking_id=fa6d12ed-e3f6-4ef1-85de-675f480b9660|San Luis Potosi, Roma Norte, Cuauhtémoc, Distrito Federal|8026715 pesos|102 m² construidos,2 recs.|503|San Luis Potosi|19.39068|-99.2836995|Publicado hace 2 meses
Departamento En Venta En Roma Norte Calle Manzanillo 22-1081|Departamento en venta|https://departamento.metroscubicos.com/MLM-1328015820-departamento-en-venta-en-roma-norte-calle-manzanillo-22-1081-_JM#position=24&search_layout=grid&type=item&tracking_id=fa6d12ed-e3f6-4ef1-85de-675f480b9660|Roma Norte, Cuauhtémoc, Distrito Federal|2595000 pesos|42 m² construidos,1 rec.|504||19.39068|-99.2836995|Publicado hace 3 meses
Departamento En Venta Roma Norte Cuauhtemoc (m2d500)|Departamento en venta|https://departamento.metroscubicos.com/MLM-1369366670-departamento-en-venta-roma-norte-cuauhtemoc-m2d500-_JM#position=25&search_layout=grid&type=item&tracking_id=fa6d12ed-e3f6-4ef1-85de-675f480b9660|Queretaro, Roma Norte, Cuauhtémoc, Distrito Federal|8500000 pesos|152 m² construidos,3 recs.|505|Queretaro|19.39068|-99.2836995|
Bodega, Almacen, Centro De Distribucion, Local En Pb En Rent|Oficina en venta|https://inmueble.metroscubicos.com/MLM-1352734266-bodega-almacen-centro-de-distribucion-local-en-pb-en-rent-_JM#position=26&search_layout=grid&type=item&tracking_id=fa6d12ed-e3f6-4ef1-85de-675f480b9660|Antonio Solis, Roma Norte, Cuauhtémoc, Distrito Federal|10350000 pesos|720 m² construidos|506|Antonio Solis|19.39068|-99.2836995|Publicado hace 2 meses
D439 - Oaxaca, Roma Norte|Departamento en venta|https://departamento.metroscubicos.com/MLM-1317154638-d439-oaxaca-roma-norte-_JM#position=27&search_layout=grid&type=item&tracking_id=fa6d12ed-e3f6-4ef1-85de-675f480b9660|Oaxaca, Roma Norte, Cuauhtémoc, Distrito Federal|5440000 pesos|77 m² construidos,2 recs.|507|Oaxaca|19.39068|-99.2836995|
Terreno Amanali  En Tepeji Del Rio|Terreno en venta|https://terreno.metroscubicos.com/MLM-1349280506-terreno-amanali-en-tepeji-del-rio-_JM#position=28&search_layout=grid&type=item&tracking_id=fa6d12ed-e3f6-4ef1-85de-675f480b9660|Roma Norte, Cuauhtémoc, Distrito Federal|3652544 pesos|1 m² construidos|508||19.39068|-99.2836995|Publicado hace 2 meses
Edificio Completo En Renta Roma Norte|Edificio en renta|https://inmueble.metroscubicos.com/MLM-1340389145-edificio-completo-en-renta-roma-norte-_JM#position=29&search_layout=grid&type=item&tracking_id=fa6d12ed-e3f6-4ef1-85de-675f480b9660|Frontera 22, Roma Norte, Cuauhtémoc, Distrito Federal|40000 pesos|200 m² construidos|509|Frontera 22|19.39068|-99.2836995|Publicado hace 3 meses
5275 Colima, Roma Norte|Departamento en venta|https://departamento.metroscubicos.com/MLM-1317114293-5275-colima-roma-norte-_JM#position=30&search_layout=grid&type=item&tracking_id=fa6d12ed-e3f6-4ef1-85de-675f480b9660|Colima, Roma Norte, Cuauhtémoc, Distrito Federal|5700000 pesos|90 m² construidos,2 recs.|510|Colima|19.39068|-99.2836995|
Venta Departamento Roma Norte Planta Baja $6,490,000|Departamento en venta|https://departamento.metroscubicos.com/MLM-931044636-venta-departamento-roma-norte-planta-baja-6490000-_JM#position=31&search_layout=grid&type=item&tracking_id=fa6d12ed-e3f6-4ef1-85de-675f480b9660|Durango, Roma Norte, Cuauhtémoc, Distrito Federal|6490000 pesos|180 m² construidos,2 recs.|511|Durango|19.39068|-99.2836995|Publicado hace 8 meses
Departamento En Venta Col. Roma Norte De 3 Habitaciones  Con 90m2 En Segundo Nivel Con Excelente Ubicacion|Departamento en venta|https://departamento.metroscubicos.com/MLM-1336869345-departamento-en-venta-col-roma-norte-de-3-habitaciones-con-90m2-en-segundo-nivel-con-excelente-ubicacion-_JM#position=32&search_layout=grid&type=item&tracking_id=fa6d12ed-e3f6-4ef1-85de-675f480b9660|Morelia 45, Roma Norte, Cuauhtémoc, Distrito Federal|4490000 pesos|90 m² construidos,3 recs.|512|Morelia 45|19.39068|-99.2836995|Publicado hace 3 meses
Casa En Venta En La Roma|Casa en venta|https://casa.metroscubicos.com/MLM-1325929404-casa-en-venta-en-la-roma-_JM#position=33&search_layout=grid&type=item&tracking_id=fa6d12ed-e3f6-4ef1-85de-675f480b9660|Cordoba, Roma Norte, Cuauhtémoc, Distrito Federal|34200000 pesos|445 m² construidos,8 recs.|513|Cordoba|19.39068|-99.2836995|Publicado hace 4 meses
Venta Oficina En La Condesa|Oficina en venta|https://inmueble.metroscubicos.com/MLM-772199459-venta-oficina-en-la-condesa-_JM#position=34&search_layout=grid&type=item&tracking_id=fa6d12ed-e3f6-4ef1-85de-675f480b9660|Roma Norte, Cuauhtémoc, Distrito Federal|5200000 pesos|136 m² construidos|514||19.39068|-99.2836995|Publicado hace 1 año
Venta Ph En Col. Roma Norte|Departamento en venta|https://departamento.metroscubicos.com/MLM-1367347758-venta-ph-en-col-roma-norte-_JM#position=35&search_layout=grid&type=item&tracking_id=fa6d12ed-e3f6-4ef1-85de-675f480b9660|Tabasco, Roma Norte, Cuauhtémoc, Distrito Federal|6960000 pesos|105 m² construidos,1 rec.|515|Tabasco|19.39068|-99.2836995|Publicado hace 27 días
Oficina - Roma Norte|Oficina en renta|https://inmueble.metroscubicos.com/MLM-1372275840-oficina-roma-norte-_JM#position=36&search_layout=grid&type=item&tracking_id=fa6d12ed-e3f6-4ef1-85de-675f480b9660|Oficinas E Renta Insurgentes Sur 64, Juárez / Edificio Centro Insurgentes-reforma B507, Cuauhtémoc, Distrito Federal|22500 pesos|71 m² de terreno|516|Oficinas E Renta Insurgentes Sur 64, Juárez / Edificio Centro Insurgentes-reforma B507|19.39068|-99.2836995|Publicado hace 15 días
Casa En La Colonia Roma Estupenda Yag|Casa en venta|https://casa.metroscubicos.com/MLM-789107717-casa-en-la-colonia-roma-estupenda-yag-_JM#position=37&search_layout=grid&type=item&tracking_id=fa6d12ed-e3f6-4ef1-85de-675f480b9660|Tehauntepec 54, Roma Sur, Cuauhtémoc, Distrito Federal|11380000 pesos|261 m² construidos,4 recs.|517|Tehauntepec 54|19.39068|-99.2836995|Publicado hace 1 año
Oficina Comercial En Venta En Roma Norte, En Cuauhtemoc, En Ciudad De Mexico|Oficina en venta|https://inmueble.metroscubicos.com/MLM-1361484573-oficina-comercial-en-venta-en-roma-norte-en-cuauhtemoc-en-ciudad-de-mexico-_JM#position=38&search_layout=grid&type=item&tracking_id=fa6d12ed-e3f6-4ef1-85de-675f480b9660|Roma Norte, Cuauhtémoc, Distrito Federal|450340 pesos|6 m² construidos|518||19.39068|-99.2836995|Publicado hace 43 días
Kw Renta Oficina En Planta Baja Sobre Av Yucatán, Colonia Roma Norte, 145 M2 / 3-privados / Sala De Juntas / 2b / 1e|Oficina en renta|https://inmueble.metroscubicos.com/MLM-1343772118-kw-renta-oficina-en-planta-baja-sobre-av-yucatan-colonia-roma-norte-145-m2-3-privados-sala-de-juntas-2b-1e-_JM#position=39&search_layout=grid&type=item&tracking_id=fa6d12ed-e3f6-4ef1-85de-675f480b9660|Roma Norte, Cuauhtémoc, Distrito Federal|35000 pesos|145 m² construidos|519||19.39068|-99.2836995|Publicado hace 2 meses
Oficinas Equipadas En Renta Av. Chapultepec Y Otra En Calle |Oficina en renta|https://inmueble.metroscubicos.com/MLM-1337030246-oficinas-equipadas-en-renta-av-chapultepec-y-otra-en-calle-_JM#position=40&search_layout=grid&type=item&tracking_id=fa6d12ed-e3f6-4ef1-85de-675f480b9660|Av. Chapultepec, Roma Norte, Cuauhtémoc, Distrito Federal|16488 pesos|1 m² construidos|520|Av. Chapultepec|19.39068|-99.2836995|Publicado hace 3 meses
Oficina - Roma Norte|Oficina en renta|https://inmueble.metroscubicos.com/MLM-1372334274-oficina-roma-norte-_JM#position=41&search_layout=grid&type=item&tracking_id=fa6d12ed-e3f6-4ef1-85de-675f480b9660|Oficinas E Renta Insurgentes Sur 64, Juárez / Edificio Centro Insurgentes-reforma A307, Cuauhtémoc, Distrito Federal|16500 pesos|53 m² de terreno|521|Oficinas E Renta Insurgentes Sur 64, Juárez / Edificio Centro Insurgentes-reforma A307|19.39068|-99.2836995|Publicado hace 15 días
¡renta Departamento En Calle Medellín!|Departamento en renta|https://departamento.metroscubicos.com/MLM-1371901184-renta-departamento-en-calle-medellin-_JM#position=42&search_layout=grid&type=item&tracking_id=fa6d12ed-e3f6-4ef1-85de-675f480b9660|Medellín, Roma Norte, Cuauhtémoc, Distrito Federal|24000 pesos|107 m² construidos,2 recs.|522|Medellín|19.39068|-99.2836995|Publicado hace 16 días
Chapultepec 322 - Roma Norte|Departamento en venta|https://departamento.metroscubicos.com/MLM-1367136379-chapultepec-322-roma-norte-_JM#position=43&search_layout=grid&type=item&tracking_id=fa6d12ed-e3f6-4ef1-85de-675f480b9660|Av Chapultepec, Roma Norte, Cuauhtémoc, Distrito Federal|5795000 pesos|85 m² construidos,2 recs.|523|Av Chapultepec|19.39068|-99.2836995|Publicado hace 28 días
Colonia Roma Se Vende  Departamento Con Roof Garden|Departamento en venta|https://departamento.metroscubicos.com/MLM-1341599373-colonia-roma-se-vende-departamento-con-roof-garden-_JM#position=44&search_layout=grid&type=item&tracking_id=fa6d12ed-e3f6-4ef1-85de-675f480b9660|Roma Norte, Cuauhtémoc, Distrito Federal|9736000 pesos|107 m² construidos,2 recs.|524||19.39068|-99.2836995|Publicado hace 2 meses
Departamento En Renta En Roma Norte|Departamento en renta|https://departamento.metroscubicos.com/MLM-1353770469-departamento-en-renta-en-roma-norte-_JM#position=45&search_layout=grid&type=item&tracking_id=fa6d12ed-e3f6-4ef1-85de-675f480b9660|Yucatan, Roma Norte, Cuauhtémoc, Distrito Federal|24000 pesos|105 m² construidos,2 recs.|525|Yucatan|19.39068|-99.2836995|Publicado hace 2 meses
Departamento En Renta En Durango Enfrente De Palacio De Hierro, Roma Norte|Departamento en renta|https://departamento.metroscubicos.com/MLM-1340389177-departamento-en-renta-en-durango-enfrente-de-palacio-de-hierro-roma-norte-_JM#position=46&search_layout=grid&type=item&tracking_id=fa6d12ed-e3f6-4ef1-85de-675f480b9660|Durango 300, Roma Norte, Cuauhtémoc, Distrito Federal|20000 pesos|100 m² construidos,2 recs.|526|Durango 300|19.39068|-99.2836995|Publicado hace 3 meses
Roma Norte, Amplias Oficinas En Renta|Oficina en renta|https://inmueble.metroscubicos.com/MLM-1323187088-roma-norte-amplias-oficinas-en-renta-_JM#position=47&search_layout=grid&type=item&tracking_id=fa6d12ed-e3f6-4ef1-85de-675f480b9660|Sinaloa, Roma Norte, Cuauhtémoc, Distrito Federal|40000 pesos|220 m² construidos|527|Sinaloa|19.39068|-99.2836995|Publicado hace 4 meses
Hermoso Departamento En El Corazón De La Roma|Departamento en venta|https://departamento.metroscubicos.com/MLM-1310484502-hermoso-departamento-en-el-corazon-de-la-roma-_JM#position=48&search_layout=grid&type=item&tracking_id=fa6d12ed-e3f6-4ef1-85de-675f480b9660|Av. Chapultepec, Roma Norte, Cuauhtémoc, Distrito Federal|4995000 pesos|85 m² construidos,2 recs.|528|Av. Chapultepec|19.39068|-99.2836995|Publicado hace 5 meses
Renta Oficina Roma Norte, Ideal Para Despacho De Abogados, C|Oficina en renta|https://inmueble.metroscubicos.com/MLM-811567317-renta-oficina-roma-norte-ideal-para-despacho-de-abogados-c-_JM#position=1&search_layout=grid&type=item&tracking_id=b490cb7b-5177-4416-85ef-e1886b42d95b|Cordoba, Roma Norte, Cuauhtémoc, Distrito Federal|74000 pesos|250 m² construidos|529|Cordoba|19.39068|-99.2836995|Publicado hace 1 año
Increíble Garden House Para Estrenar En La Colonia Roma.|Departamento en renta|https://departamento.metroscubicos.com/MLM-1371245109-increible-garden-house-para-estrenar-en-la-colonia-roma-_JM#position=2&search_layout=grid&type=item&tracking_id=b490cb7b-5177-4416-85ef-e1886b42d95b|Zacatecas, Roma Norte, Cuauhtémoc, Distrito Federal|50000 pesos|185 m² construidos,3 recs.|530|Zacatecas|19.39068|-99.2836995|Publicado hace 18 días
Increíble Casa En Venta Con Local Comercial|Casa en venta|https://casa.metroscubicos.com/MLM-1374190393-increible-casa-en-venta-con-local-comercial-_JM#position=3&search_layout=grid&type=item&tracking_id=b490cb7b-5177-4416-85ef-e1886b42d95b|Cordoba, Roma Norte, Cuauhtémoc, Distrito Federal|19500000 pesos|255 m² construidos,3 recs.|531|Cordoba|19.39068|-99.2836995|Publicado hace 11 días
Corporativo Álvaro Obregón 121|Oficina en renta|https://inmueble.metroscubicos.com/MLM-1353752998-corporativo-alvaro-obregon-121-_JM#position=4&search_layout=grid&type=item&tracking_id=b490cb7b-5177-4416-85ef-e1886b42d95b|Av. Álvaro Obregón, Roma Norte, Cuauhtémoc, Distrito Federal|280 pesos|3,248 m² construidos|532|Av. Álvaro Obregón|19.39068|-99.2836995|
Departamento En Roma Norte, Cuauhtémoc|Departamento en renta|https://departamento.metroscubicos.com/MLM-1330183898-departamento-en-roma-norte-cuauhtemoc-_JM#position=5&search_layout=grid&type=item&tracking_id=b490cb7b-5177-4416-85ef-e1886b42d95b|Avenida Álvaro Obregón, Roma Norte, Cuauhtémoc, Distrito Federal|24000 pesos|100 m² construidos,2 recs.|533|Avenida Álvaro Obregón|19.39068|-99.2836995|Publicado hace 3 meses
Departamento En Venta Roma Norte Cuauhtémoc (m2d1464)|Departamento en venta|https://departamento.metroscubicos.com/MLM-1369240977-departamento-en-venta-roma-norte-cuauhtemoc-m2d1464-_JM#position=6&search_layout=grid&type=item&tracking_id=b490cb7b-5177-4416-85ef-e1886b42d95b|Guanajuato, Roma Norte, Cuauhtémoc, Distrito Federal|10250000 pesos|157 m² construidos,3 recs.|534|Guanajuato|19.39068|-99.2836995|
Se Renta Amplia Oficina En Colonia Roma Norte|Oficina en renta|https://inmueble.metroscubicos.com/MLM-1364425966-se-renta-amplia-oficina-en-colonia-roma-norte-_JM#position=7&search_layout=grid&type=item&tracking_id=b490cb7b-5177-4416-85ef-e1886b42d95b|Roma Norte, Cuauhtémoc, Distrito Federal|222250 pesos|635 m² construidos|535||19.39068|-99.2836995|Publicado hace 35 días
Casa En Venta ,col. Roma Norte, Cuauhtemoc|Casa en venta|https://casa.metroscubicos.com/MLM-1373418765-casa-en-venta-col-roma-norte-cuauhtemoc-_JM#position=8&search_layout=grid&type=item&tracking_id=b490cb7b-5177-4416-85ef-e1886b42d95b|Córdoba, Roma Norte, Cuauhtémoc, Distrito Federal|18900000 pesos|332 m² construidos|536|Córdoba|19.39068|-99.2836995|Publicado hace 13 días
Departamento En Venta Roma Norte|Departamento en venta|https://departamento.metroscubicos.com/MLM-1330130704-departamento-en-venta-roma-norte-_JM#position=9&search_layout=grid&type=item&tracking_id=b490cb7b-5177-4416-85ef-e1886b42d95b|Zacatecas, Roma Norte, Cuauhtémoc, Distrito Federal|14040000 pesos|270 m² construidos,3 recs.|537|Zacatecas|19.39068|-99.2836995|Publicado hace 3 meses
Av. Yucatán 132, Roma Norte|Departamento en venta|https://departamento.metroscubicos.com/MLM-1371008782-av-yucatan-132-roma-norte-_JM#position=10&search_layout=grid&type=item&tracking_id=b490cb7b-5177-4416-85ef-e1886b42d95b|Av. Yucatán, Roma Norte, Cuauhtémoc, Distrito Federal|4500000 pesos|93 m² construidos,2 recs.|538|Av. Yucatán|19.39068|-99.2836995|Publicado hace 18 días
Corazon De La Colonia Roma|Departamento en venta|https://departamento.metroscubicos.com/MLM-1344125271-corazon-de-la-colonia-roma-_JM#position=11&search_layout=grid&type=item&tracking_id=b490cb7b-5177-4416-85ef-e1886b42d95b|Cordoba, Roma Norte, Cuauhtémoc, Distrito Federal|6995000 pesos|121 m² construidos,2 recs.|539|Cordoba|19.39068|-99.2836995|Publicado hace 2 meses
Departamento En Venta En Roma Norte|Departamento en venta|https://departamento.metroscubicos.com/MLM-1330111135-departamento-en-venta-en-roma-norte-_JM#position=12&search_layout=grid&type=item&tracking_id=b490cb7b-5177-4416-85ef-e1886b42d95b|Córdoba, Roma Norte, Cuauhtémoc, Distrito Federal|4495000 pesos|86 m² construidos,3 recs.|540|Córdoba|19.39068|-99.2836995|Publicado hace 3 meses
Renta Departamento Roma Norte , Calle Puebla|Departamento en renta|https://departamento.metroscubicos.com/MLM-1364495704-renta-departamento-roma-norte-calle-puebla-_JM#position=13&search_layout=grid&type=item&tracking_id=b490cb7b-5177-4416-85ef-e1886b42d95b|Puebla, Roma Norte, Cuauhtémoc, Distrito Federal|20000 pesos|120 m² construidos,2 recs.|541|Puebla|19.39068|-99.2836995|Publicado hace 35 días
Casa Uso De Suelo En Renta En Roma Norte, Cuauhtémoc, Distrito Federal|Casa en renta|https://casa.metroscubicos.com/MLM-1373407689-casa-uso-de-suelo-en-renta-en-roma-norte-cuauhtemoc-distrito-federal-_JM#position=14&search_layout=grid&type=item&tracking_id=b490cb7b-5177-4416-85ef-e1886b42d95b|Roma Norte, Cuauhtémoc, Distrito Federal|59900 pesos|290 m² construidos,5 recs.|542||19.39068|-99.2836995|Publicado hace 12 días
Departamento - Roma Norte|Departamento en venta|https://departamento.metroscubicos.com/MLM-1372288830-departamento-roma-norte-_JM#position=15&search_layout=grid&type=item&tracking_id=b490cb7b-5177-4416-85ef-e1886b42d95b|Departamentos Nuevos Roma Norte Coahuila, Cuauhtémoc, Distrito Federal|6030150 pesos|93 m² de terreno,2 recs.|543|Departamentos Nuevos Roma Norte Coahuila|19.39068|-99.2836995|Publicado hace 15 días
Departamento - Roma Norte|Departamento en venta|https://departamento.metroscubicos.com/MLM-1372301759-departamento-roma-norte-_JM#position=16&search_layout=grid&type=item&tracking_id=b490cb7b-5177-4416-85ef-e1886b42d95b|Departamentos Nuevos Roma Norte Coahuila, Cuauhtémoc, Distrito Federal|5937050 pesos|93 m² de terreno,2 recs.|544|Departamentos Nuevos Roma Norte Coahuila|19.39068|-99.2836995|Publicado hace 15 días
Departamento - Roma Norte|Departamento en venta|https://departamento.metroscubicos.com/MLM-1372334236-departamento-roma-norte-_JM#position=17&search_layout=grid&type=item&tracking_id=b490cb7b-5177-4416-85ef-e1886b42d95b|Departamentos Nuevos Roma Norte Coahuila, Cuauhtémoc, Distrito Federal|6767250 pesos|93 m² de terreno,2 recs.|545|Departamentos Nuevos Roma Norte Coahuila|19.39068|-99.2836995|Publicado hace 15 días
Departamento - Roma Norte|Departamento en venta|https://departamento.metroscubicos.com/MLM-1372308155-departamento-roma-norte-_JM#position=18&search_layout=grid&type=item&tracking_id=b490cb7b-5177-4416-85ef-e1886b42d95b|Departamentos Nuevos Roma Norte Coahuila, Cuauhtémoc, Distrito Federal|5924650 pesos|92 m² de terreno,2 recs.|546|Departamentos Nuevos Roma Norte Coahuila|19.39068|-99.2836995|Publicado hace 15 días
Departamento - Roma Norte|Departamento en venta|https://departamento.metroscubicos.com/MLM-1372282340-departamento-roma-norte-_JM#position=19&search_layout=grid&type=item&tracking_id=b490cb7b-5177-4416-85ef-e1886b42d95b|Departamentos Nuevos Roma Norte Coahuila, Cuauhtémoc, Distrito Federal|4655643 pesos|78 m² de terreno,2 recs.|547|Departamentos Nuevos Roma Norte Coahuila|19.39068|-99.2836995|Publicado hace 15 días
Departamento - Roma Norte|Departamento en venta|https://departamento.metroscubicos.com/MLM-1372301749-departamento-roma-norte-_JM#position=20&search_layout=grid&type=item&tracking_id=b490cb7b-5177-4416-85ef-e1886b42d95b|Departamentos Nuevos Roma Norte Coahuila, Cuauhtémoc, Distrito Federal|4916300 pesos|76 m² de terreno,2 recs.|548|Departamentos Nuevos Roma Norte Coahuila|19.39068|-99.2836995|Publicado hace 15 días
Departamento - Roma Norte|Departamento en venta|https://departamento.metroscubicos.com/MLM-1372334220-departamento-roma-norte-_JM#position=21&search_layout=grid&type=item&tracking_id=b490cb7b-5177-4416-85ef-e1886b42d95b|Departamentos Nuevos Roma Norte Coahuila, Cuauhtémoc, Distrito Federal|4441570 pesos|74 m² de terreno,2 recs.|549|Departamentos Nuevos Roma Norte Coahuila|19.39068|-99.2836995|Publicado hace 15 días
Departamento - Roma Norte|Departamento en venta|https://departamento.metroscubicos.com/MLM-1372282334-departamento-roma-norte-_JM#position=22&search_layout=grid&type=item&tracking_id=b490cb7b-5177-4416-85ef-e1886b42d95b|Departamentos Nuevos Roma Norte Coahuila, Cuauhtémoc, Distrito Federal|5704875 pesos|76 m² de terreno,2 recs.|550|Departamentos Nuevos Roma Norte Coahuila|19.39068|-99.2836995|Publicado hace 15 días
Departamento - Roma Norte|Departamento en venta|https://departamento.metroscubicos.com/MLM-1372308146-departamento-roma-norte-_JM#position=23&search_layout=grid&type=item&tracking_id=b490cb7b-5177-4416-85ef-e1886b42d95b|Departamentos Nuevos Roma Norte Coahuila, Cuauhtémoc, Distrito Federal|9119400 pesos|99 m² de terreno,2 recs.|551|Departamentos Nuevos Roma Norte Coahuila|19.39068|-99.2836995|Publicado hace 15 días
Departamento - Roma Norte|Departamento en venta|https://departamento.metroscubicos.com/MLM-1372334218-departamento-roma-norte-_JM#position=24&search_layout=grid&type=item&tracking_id=b490cb7b-5177-4416-85ef-e1886b42d95b|Departamentos Nuevos Roma Norte Coahuila, Cuauhtémoc, Distrito Federal|5750850 pesos|93 m² de terreno,2 recs.|552|Departamentos Nuevos Roma Norte Coahuila|19.39068|-99.2836995|Publicado hace 15 días
Departamento - Roma Norte|Departamento en venta|https://departamento.metroscubicos.com/MLM-1372288815-departamento-roma-norte-_JM#position=25&search_layout=grid&type=item&tracking_id=b490cb7b-5177-4416-85ef-e1886b42d95b|Departamentos Nuevos Roma Norte Coahuila, Cuauhtémoc, Distrito Federal|5843950 pesos|93 m² de terreno,2 recs.|553|Departamentos Nuevos Roma Norte Coahuila|19.39068|-99.2836995|Publicado hace 15 días
Departamento - Roma Norte|Departamento en venta|https://departamento.metroscubicos.com/MLM-1372295335-departamento-roma-norte-_JM#position=26&search_layout=grid&type=item&tracking_id=b490cb7b-5177-4416-85ef-e1886b42d95b|Departamentos Nuevos Roma Norte Coahuila, Cuauhtémoc, Distrito Federal|5831750 pesos|92 m² de terreno,2 recs.|554|Departamentos Nuevos Roma Norte Coahuila|19.39068|-99.2836995|Publicado hace 15 días
Departamento - Roma Norte|Departamento en venta|https://departamento.metroscubicos.com/MLM-1372288813-departamento-roma-norte-_JM#position=27&search_layout=grid&type=item&tracking_id=b490cb7b-5177-4416-85ef-e1886b42d95b|Departamentos Nuevos Roma Norte Coahuila, Cuauhtémoc, Distrito Federal|6017550 pesos|92 m² de terreno,2 recs.|555|Departamentos Nuevos Roma Norte Coahuila|19.39068|-99.2836995|Publicado hace 15 días
Departamento - Roma Norte|Departamento en venta|https://departamento.metroscubicos.com/MLM-1372308145-departamento-roma-norte-_JM#position=28&search_layout=grid&type=item&tracking_id=b490cb7b-5177-4416-85ef-e1886b42d95b|Departamentos Nuevos Roma Norte Coahuila, Cuauhtémoc, Distrito Federal|6747750 pesos|92 m² de terreno,2 recs.|556|Departamentos Nuevos Roma Norte Coahuila|19.39068|-99.2836995|Publicado hace 15 días
Departamento - Roma Norte|Departamento en venta|https://departamento.metroscubicos.com/MLM-1372288812-departamento-roma-norte-_JM#position=29&search_layout=grid&type=item&tracking_id=b490cb7b-5177-4416-85ef-e1886b42d95b|Departamentos Nuevos Roma Norte Coahuila, Cuauhtémoc, Distrito Federal|4419100 pesos|74 m² de terreno,2 recs.|557|Departamentos Nuevos Roma Norte Coahuila|19.39068|-99.2836995|Publicado hace 15 días
Departamento - Roma Norte|Departamento en venta|https://departamento.metroscubicos.com/MLM-1372314789-departamento-roma-norte-_JM#position=30&search_layout=grid&type=item&tracking_id=b490cb7b-5177-4416-85ef-e1886b42d95b|Departamentos Nuevos Roma Norte Coahuila, Cuauhtémoc, Distrito Federal|6915220 pesos|89 m² de terreno,2 recs.|558|Departamentos Nuevos Roma Norte Coahuila|19.39068|-99.2836995|Publicado hace 15 días
Departamento - Roma Norte|Departamento en venta|https://departamento.metroscubicos.com/MLM-1372295334-departamento-roma-norte-_JM#position=31&search_layout=grid&type=item&tracking_id=b490cb7b-5177-4416-85ef-e1886b42d95b|Departamentos Nuevos Roma Norte Coahuila, Cuauhtémoc, Distrito Federal|7574580 pesos|89 m² de terreno,2 recs.|559|Departamentos Nuevos Roma Norte Coahuila|19.39068|-99.2836995|Publicado hace 15 días
Departamento - Roma Norte|Departamento en venta|https://departamento.metroscubicos.com/MLM-1372321173-departamento-roma-norte-_JM#position=32&search_layout=grid&type=item&tracking_id=b490cb7b-5177-4416-85ef-e1886b42d95b|Departamentos Nuevos Roma Norte Coahuila, Cuauhtémoc, Distrito Federal|7299250 pesos|89 m² de terreno,2 recs.|560|Departamentos Nuevos Roma Norte Coahuila|19.39068|-99.2836995|Publicado hace 15 días
Departamento - Roma Norte|Departamento en venta|https://departamento.metroscubicos.com/MLM-1372282331-departamento-roma-norte-_JM#position=33&search_layout=grid&type=item&tracking_id=b490cb7b-5177-4416-85ef-e1886b42d95b|Departamentos Nuevos Roma Norte Coahuila, Cuauhtémoc, Distrito Federal|6969200 pesos|84 m² de terreno,2 recs.|561|Departamentos Nuevos Roma Norte Coahuila|19.39068|-99.2836995|Publicado hace 15 días
