main_name|subtitle|link|location|price|attributes|id|address|lat|lon|since
Renta Departamento En Roma Norte|Departamento en renta|https://departamento.metroscubicos.com/MLM-1376327757-renta-departamento-en-roma-norte-_JM#position=1&search_layout=grid&type=item&tracking_id=077a4fe9-ef0c-4d2d-abe1-8f19ecb9fb61|Av Chapultepec 322, Roma Norte, Ciudad De México, Cdmx, México, Roma Norte, Cuauhtémoc, Distrito Federal|17500 pesos|85 m² construidos,2 recs.|1|Av Chapultepec 322, Roma Norte, Ciudad De México, Cdmx, México|19.39068|-99.2836995|Publicado hace 6 días
Casa En Venta Colonia Roma Norte|Casa en venta|https://casa.metroscubicos.com/MLM-1376829218-casa-en-venta-colonia-roma-norte-_JM#position=2&search_layout=grid&type=item&tracking_id=077a4fe9-ef0c-4d2d-abe1-8f19ecb9fb61|Roma Norte, Cuauhtémoc, Distrito Federal|19500000 pesos|255 m² construidos,3 recs.|2||19.39068|-99.2836995|Publicado hace 5 días
Departamento En Venta En Col. Roma Norte, Cuauhtémoc|Departamento en venta|https://departamento.metroscubicos.com/MLM-1378964342-departamento-en-venta-en-col-roma-norte-cuauhtemoc-_JM#position=3&search_layout=grid&type=item&tracking_id=077a4fe9-ef0c-4d2d-abe1-8f19ecb9fb61|San Luis Potosí, Roma Norte, Cuauhtémoc, Distrito Federal|5295000 pesos|135 m² construidos,3 recs.|3|San Luis Potosí|19.39068|-99.2836995|Publicado hace 1 día
Departamento En Venta En Col. Roma Norte, Cuauhtémoc|Departamento en venta|https://departamento.metroscubicos.com/MLM-1378964344-departamento-en-venta-en-col-roma-norte-cuauhtemoc-_JM#position=4&search_layout=grid&type=item&tracking_id=077a4fe9-ef0c-4d2d-abe1-8f19ecb9fb61|San Luis Potosí, Roma Norte, Cuauhtémoc, Distrito Federal|5495000 pesos|79 m² construidos,2 recs.|4|San Luis Potosí|19.39068|-99.2836995|Publicado hace 1 día
Departamento En Venta Con Terraza, Roma Norte, Cuauhtemoc|Departamento en venta|https://departamento.metroscubicos.com/MLM-1378230865-departamento-en-venta-con-terraza-roma-norte-cuauhtemoc-_JM#position=5&search_layout=grid&type=item&tracking_id=077a4fe9-ef0c-4d2d-abe1-8f19ecb9fb61|Roma Norte, Cuauhtémoc, Distrito Federal|5495000 pesos|79 m² construidos,2 recs.|5||19.39068|-99.2836995|Publicado hace 2 días
Renta Casa A Estrenar En Condominio Roma Norte|Casa en renta|https://casa.metroscubicos.com/MLM-1377874437-renta-casa-a-estrenar-en-condominio-roma-norte-_JM#position=6&search_layout=grid&type=item&tracking_id=077a4fe9-ef0c-4d2d-abe1-8f19ecb9fb61|Cozumel S/n, Roma Norte, Cuauhtémoc, Distrito Federal|45000 pesos|169 m² construidos,3 recs.|6|Cozumel S/n|19.39068|-99.2836995|Publicado hace 4 días
Venta Departamento Roma Alberca Cuauhtemoc|Departamento en venta|https://departamento.metroscubicos.com/MLM-941664473-venta-departamento-roma-alberca-cuauhtemoc-_JM#position=7&search_layout=grid&type=item&tracking_id=077a4fe9-ef0c-4d2d-abe1-8f19ecb9fb61|Queretaro, Roma Norte, Cuauhtémoc, Distrito Federal|6700000 pesos|90 m² construidos,2 recs.|7|Queretaro|19.39068|-99.2836995|Publicado hace 7 meses
Departamento En Venta En Roma Norte, Cuauhtémoc|Departamento en venta|https://departamento.metroscubicos.com/MLM-1361677423-departamento-en-venta-en-roma-norte-cuauhtemoc-_JM#position=8&search_layout=grid&type=item&tracking_id=077a4fe9-ef0c-4d2d-abe1-8f19ecb9fb61|Chihuahua, Roma Norte, Cuauhtémoc, Distrito Federal|2800000 pesos|70 m² construidos,2 recs.|8|Chihuahua|19.39068|-99.2836995|Publicado hace 43 días
Departamento En Roma Norte, Cuauhtémoc Con 3 Recámaras, 146 M², Id: 36895|Departamento en venta|https://departamento.metroscubicos.com/MLM-1323145292-departamento-en-roma-norte-cuauhtemoc-con-3-recamaras-146-m-id-36895-_JM#position=9&search_layout=grid&type=item&tracking_id=077a4fe9-ef0c-4d2d-abe1-8f19ecb9fb61|San Luis Potosí, Roma Norte, Cuauhtémoc, Distrito Federal|7500000 pesos|146 m² construidos,3 recs.|9|San Luis Potosí|19.39068|-99.2836995|
Departamento En Renta En Element Roma (303)|Departamento en renta|https://departamento.metroscubicos.com/MLM-875782610-departamento-en-renta-en-element-roma-303-_JM#position=10&search_layout=grid&type=item&tracking_id=077a4fe9-ef0c-4d2d-abe1-8f19ecb9fb61|Colima 334, Roma Norte, Cuauhtémoc, Distrito Federal|28500 pesos|89 m² construidos,2 recs.|10|Colima 334|19.39068|-99.2836995|Publicado hace 1 año
Departamento En Venta En Tonalá, Roma Norte Para Inversionis|Departamento en venta|https://departamento.metroscubicos.com/MLM-1362106251-departamento-en-venta-en-tonala-roma-norte-para-inversionis-_JM#position=11&search_layout=grid&type=item&tracking_id=077a4fe9-ef0c-4d2d-abe1-8f19ecb9fb61|Tonala, Roma Norte, Cuauhtémoc, Distrito Federal|8550000 pesos|114 m² construidos,2 recs.|11|Tonala|19.39068|-99.2836995|Publicado hace 42 días
Departamento En Roma Norte, Cuauhtémoc Con 2 Recámaras, 202 M², Id: 57072|Departamento en venta|https://departamento.metroscubicos.com/MLM-1375792024-departamento-en-roma-norte-cuauhtemoc-con-2-recamaras-202-m-id-57072-_JM#position=12&search_layout=grid&type=item&tracking_id=077a4fe9-ef0c-4d2d-abe1-8f19ecb9fb61|San Luis Potosí 78, Roma Norte, Cuauhtémoc, Distrito Federal|8000000 pesos|202 m² construidos,2 recs.|12|San Luis Potosí 78|19.39068|-99.2836995|
Sinaloa Roma Norte|Departamento en venta|https://departamento.metroscubicos.com/MLM-1317100429-sinaloa-roma-norte-_JM#position=13&search_layout=grid&type=item&tracking_id=077a4fe9-ef0c-4d2d-abe1-8f19ecb9fb61|Sinaloa, Roma Norte, Cuauhtémoc, Distrito Federal|4100000 pesos|64 m² construidos,1 rec.|13|Sinaloa|19.39068|-99.2836995|
Venta Departamento Remodelado Roma Norte Baja De Precio!!|Departamento en venta|https://departamento.metroscubicos.com/MLM-1358541533-venta-departamento-remodelado-roma-norte-baja-de-precio-_JM#position=14&search_layout=grid&type=item&tracking_id=077a4fe9-ef0c-4d2d-abe1-8f19ecb9fb61|Guanajuato, Roma Norte, Cuauhtémoc, Distrito Federal|2750000 pesos|68 m² construidos,2 recs.|14|Guanajuato|19.39068|-99.2836995|Publicado hace 54 días
Departamento En Roma Norte, Cuauhtémoc Con 2 Recámaras, 146 M², Id: 56344|Departamento en venta|https://departamento.metroscubicos.com/MLM-1375823469-departamento-en-roma-norte-cuauhtemoc-con-2-recamaras-146-m-id-56344-_JM#position=15&search_layout=grid&type=item&tracking_id=077a4fe9-ef0c-4d2d-abe1-8f19ecb9fb61|Avenida Chapultepec, Roma Norte, Cuauhtémoc, Distrito Federal|7425000 pesos|146 m² construidos,2 recs.|15|Avenida Chapultepec|19.39068|-99.2836995|
Departamento En Roma Norte, Cuauhtémoc Con 2 Recámaras, 90 M², Id: 56425|Departamento en venta|https://departamento.metroscubicos.com/MLM-1375804613-departamento-en-roma-norte-cuauhtemoc-con-2-recamaras-90-m-id-56425-_JM#position=16&search_layout=grid&type=item&tracking_id=077a4fe9-ef0c-4d2d-abe1-8f19ecb9fb61|San Luis Potosí, Roma Norte, Cuauhtémoc, Distrito Federal|5600000 pesos|90 m² construidos,2 recs.|16|San Luis Potosí|19.39068|-99.2836995|
Departamento Cerca De Metro Insurgentes Y Av Cuauhtémoc|Departamento en renta|https://departamento.metroscubicos.com/MLM-1359412176-departamento-cerca-de-metro-insurgentes-y-av-cuauhtemoc-_JM#position=17&search_layout=grid&type=item&tracking_id=077a4fe9-ef0c-4d2d-abe1-8f19ecb9fb61|Colima 46, Roma Norte, Cuauhtémoc, Distrito Federal|22000 pesos|120 m² construidos,2 recs.|17|Colima 46|19.39068|-99.2836995|Publicado hace 3 meses
Local Nuevo En Ubicación Perfecta En Colonia Roma Norte - Opción A Duplicar Área|Local comercial en venta|https://inmueble.metroscubicos.com/MLM-1375640343-local-nuevo-en-ubicacion-perfecta-en-colonia-roma-norte-opcion-a-duplicar-area-_JM#position=18&search_layout=grid&type=item&tracking_id=077a4fe9-ef0c-4d2d-abe1-8f19ecb9fb61|Av. Eje 2 Sur (queretaro) 90, Roma Nte., Cuauhtémoc, 06700 Ciudad De México, Cdmx, Mexico, Roma Norte, Cuauhtémoc, Distrito Federal|3998000 pesos|34 m² construidos|18|Av. Eje 2 Sur (queretaro) 90, Roma Nte., Cuauhtémoc, 06700 Ciudad De México, Cdmx, Mexico|19.39068|-99.2836995|Publicado hace 49 días
2799 Guanajuato, Roma Norte|Departamento en venta|https://departamento.metroscubicos.com/MLM-1317159822-2799-guanajuato-roma-norte-_JM#position=19&search_layout=grid&type=item&tracking_id=077a4fe9-ef0c-4d2d-abe1-8f19ecb9fb61|Guanajuato, Roma Norte, Cuauhtémoc, Distrito Federal|6000000 pesos|100 m² construidos,2 recs.|19|Guanajuato|19.39068|-99.2836995|
662 San Luis Potosí, Roma Norte|Departamento en venta|https://departamento.metroscubicos.com/MLM-1317159575-662-san-luis-potosi-roma-norte-_JM#position=20&search_layout=grid&type=item&tracking_id=077a4fe9-ef0c-4d2d-abe1-8f19ecb9fb61|San Luis Potosí, Roma Norte, Cuauhtémoc, Distrito Federal|5900000 pesos|115 m² construidos,3 recs.|20|San Luis Potosí|19.39068|-99.2836995|
3320 Coahuila, Roma Norte|Departamento en venta|https://departamento.metroscubicos.com/MLM-1317108270-3320-coahuila-roma-norte-_JM#position=21&search_layout=grid&type=item&tracking_id=077a4fe9-ef0c-4d2d-abe1-8f19ecb9fb61|Coahuila, Roma Norte, Cuauhtémoc, Distrito Federal|4690000 pesos|70 m² construidos,1 rec.|21|Coahuila|19.39068|-99.2836995|
Departamento En Venta En Roma Norte|Departamento en venta|https://departamento.metroscubicos.com/MLM-927094347-departamento-en-venta-en-roma-norte-_JM#position=22&search_layout=grid&type=item&tracking_id=077a4fe9-ef0c-4d2d-abe1-8f19ecb9fb61|Cerrada Salamanca 73, Roma Norte, Cuauhtémoc, Distrito Federal|4200000 pesos|95 m² construidos,2 recs.|22|Cerrada Salamanca 73|19.39068|-99.2836995|Publicado hace 2 años
Departamento En Venta Calle Tonalá 122 Colonia Roma|Departamento en venta|https://departamento.metroscubicos.com/MLM-1359190040-departamento-en-venta-calle-tonala-122-colonia-roma-_JM#position=23&search_layout=grid&type=item&tracking_id=077a4fe9-ef0c-4d2d-abe1-8f19ecb9fb61|Tonala 122, Roma Norte, Cuauhtémoc, Distrito Federal|2800000 pesos|81 m² construidos,3 recs.|23|Tonala 122|19.39068|-99.2836995|Publicado hace 1 año
Espléndido Departamento En La Roma|Departamento en renta|https://departamento.metroscubicos.com/MLM-1356010656-esplendido-departamento-en-la-roma-_JM#position=24&search_layout=grid&type=item&tracking_id=077a4fe9-ef0c-4d2d-abe1-8f19ecb9fb61|Zacatecas 65, Roma Norte, Cuauhtémoc, Distrito Federal|21500 pesos|95 m² construidos,3 recs.|24|Zacatecas 65|19.39068|-99.2836995|Publicado hace 4 meses
1360 Av. Chapultepec, Roma Norte|Departamento en venta|https://departamento.metroscubicos.com/MLM-1317153925-1360-av-chapultepec-roma-norte-_JM#position=25&search_layout=grid&type=item&tracking_id=077a4fe9-ef0c-4d2d-abe1-8f19ecb9fb61|Av  Chapultepec, Roma Norte, Cuauhtémoc, Distrito Federal|6500000 pesos|187 m² construidos,3 recs.|25|Av  Chapultepec|19.39068|-99.2836995|
Departamento De 2 Niveles En La Roma Norte|Departamento en venta|https://departamento.metroscubicos.com/MLM-1371129382-departamento-de-2-niveles-en-la-roma-norte-_JM#position=26&search_layout=grid&type=item&tracking_id=077a4fe9-ef0c-4d2d-abe1-8f19ecb9fb61|Córdoba 74, Roma Norte, Ciudad De México, Cdmx, México, Roma Norte, Cuauhtémoc, Distrito Federal|5990000 pesos|128 m² construidos,2 recs.|26|Córdoba 74, Roma Norte, Ciudad De México, Cdmx, México|19.39068|-99.2836995|Publicado hace 18 días
Últimos Deptos En Preventa En Roma Norte|Departamento en venta|https://departamento.metroscubicos.com/MLM-1374256918-ultimos-deptos-en-preventa-en-roma-norte-_JM#position=27&search_layout=grid&type=item&tracking_id=077a4fe9-ef0c-4d2d-abe1-8f19ecb9fb61|Frontera, Roma Norte, Cuauhtémoc, Distrito Federal|6732700 pesos|103 m² construidos,2 recs.|27|Frontera|19.39068|-99.2836995|Publicado hace 11 días
Renta Departamento En Roma Norte|Departamento en renta|https://departamento.metroscubicos.com/MLM-1362972854-renta-departamento-en-roma-norte-_JM#position=28&search_layout=grid&type=item&tracking_id=077a4fe9-ef0c-4d2d-abe1-8f19ecb9fb61|Sinaloa 170, Roma Norte, Ciudad De México, Cdmx, México, Roma Norte, Cuauhtémoc, Distrito Federal|21000 pesos|92 m² construidos,2 recs.|28|Sinaloa 170, Roma Norte, Ciudad De México, Cdmx, México|19.39068|-99.2836995|Publicado hace 40 días
Excelente Departamento En La Condesa, Cdmx, 4349|Departamento en renta|https://departamento.metroscubicos.com/MLM-1352115657-excelente-departamento-en-la-condesa-cdmx-4349-_JM#position=29&search_layout=grid&type=item&tracking_id=077a4fe9-ef0c-4d2d-abe1-8f19ecb9fb61|Salamanca, Roma Norte, Cuauhtémoc, Distrito Federal|19700 pesos|60 m² construidos,2 recs.|29|Salamanca|19.39068|-99.2836995|
D283 - Coahuila|Departamento en venta|https://departamento.metroscubicos.com/MLM-1316982655-d283-coahuila-_JM#position=30&search_layout=grid&type=item&tracking_id=077a4fe9-ef0c-4d2d-abe1-8f19ecb9fb61|Coahuila, Roma Norte, Cuauhtémoc, Distrito Federal|3150850 pesos|41 m² construidos,1 rec.|30|Coahuila|19.39068|-99.2836995|
Renta Local Comercial Roma Norte Cuauhtémoc|Local comercial en renta|https://inmueble.metroscubicos.com/MLM-1358175955-renta-local-comercial-roma-norte-cuauhtemoc-_JM#position=31&search_layout=grid&type=item&tracking_id=077a4fe9-ef0c-4d2d-abe1-8f19ecb9fb61|Roma Norte, Cuauhtémoc, Distrito Federal|85000 pesos|445 m² construidos|31||19.39068|-99.2836995|Publicado hace 55 días
Preventa Exclusiva · Terraloza Roma Norte ·|Departamento en venta|https://departamento.metroscubicos.com/MLM-1367171972-preventa-exclusiva-terraloza-roma-norte--_JM#position=32&search_layout=grid&type=item&tracking_id=077a4fe9-ef0c-4d2d-abe1-8f19ecb9fb61|Tonala, Roma Norte, Cuauhtémoc, Distrito Federal|4264000 pesos|54 m² construidos,1 rec.|32|Tonala|19.39068|-99.2836995|Publicado hace 28 días
Departamento En Venta, Roma Norte, Guanajuato (202)|Departamento en venta|https://departamento.metroscubicos.com/MLM-1370007737-departamento-en-venta-roma-norte-guanajuato-202-_JM#position=33&search_layout=grid&type=item&tracking_id=077a4fe9-ef0c-4d2d-abe1-8f19ecb9fb61|Guanajuato, Cuauhtémoc, Distrito Federal|9789570 pesos|153 m² construidos,3 recs.|33|Guanajuato|19.39068|-99.2836995|Publicado hace 20 días
Oficina En Renta De 125 M2 En La Colonia Roma, Cerca A Metro|Oficina en renta|https://inmueble.metroscubicos.com/MLM-1353707665-oficina-en-renta-de-125-m2-en-la-colonia-roma-cerca-a-metro-_JM#position=34&search_layout=grid&type=item&tracking_id=077a4fe9-ef0c-4d2d-abe1-8f19ecb9fb61|Guanajuato, Roma Norte, Cuauhtémoc, Distrito Federal|30000 pesos|125 m² construidos|34|Guanajuato|19.39068|-99.2836995|
Renta Oficina Roma Cuauhtémoc|Oficina en renta|https://inmueble.metroscubicos.com/MLM-1358120260-renta-oficina-roma-cuauhtemoc-_JM#position=35&search_layout=grid&type=item&tracking_id=077a4fe9-ef0c-4d2d-abe1-8f19ecb9fb61|Roma Norte, Cuauhtémoc, Distrito Federal|45000 pesos|170 m² construidos|35||19.39068|-99.2836995|Publicado hace 55 días
Departamento En Renta En Element Roma (302)|Departamento en renta|https://departamento.metroscubicos.com/MLM-875782606-departamento-en-renta-en-element-roma-302-_JM#position=36&search_layout=grid&type=item&tracking_id=077a4fe9-ef0c-4d2d-abe1-8f19ecb9fb61|Colima 334, Roma Norte, Cuauhtémoc, Distrito Federal|38500 pesos|106 m² construidos,2 recs.|36|Colima 334|19.39068|-99.2836995|Publicado hace 1 año
Departamento En Venta Colonia Roma 3 Recámaras|Departamento en venta|https://departamento.metroscubicos.com/MLM-1361671133-departamento-en-venta-colonia-roma-3-recamaras-_JM#position=37&search_layout=grid&type=item&tracking_id=077a4fe9-ef0c-4d2d-abe1-8f19ecb9fb61|San Luis Potosi, Roma Norte, Cuauhtémoc, Distrito Federal|11407308 pesos|158 m² construidos,2 recs.|37|San Luis Potosi|19.39068|-99.2836995|Publicado hace 43 días
Oficina En Venta, Col. Roma Norte (zacatecas) |Oficina en venta|https://inmueble.metroscubicos.com/MLM-1370153331-oficina-en-venta-col-roma-norte-zacatecas-_JM#position=38&search_layout=grid&type=item&tracking_id=077a4fe9-ef0c-4d2d-abe1-8f19ecb9fb61|Zacatecas, Cuauhtémoc, Distrito Federal|1300000 pesos|23 m² construidos|38|Zacatecas|19.39068|-99.2836995|Publicado hace 20 días
Departamento En Roma Norte, Cuauhtémoc Con 3 Recámaras, 141 M², Id: 49920|Departamento en venta|https://departamento.metroscubicos.com/MLM-1361331494-departamento-en-roma-norte-cuauhtemoc-con-3-recamaras-141-m-id-49920-_JM#position=39&search_layout=grid&type=item&tracking_id=077a4fe9-ef0c-4d2d-abe1-8f19ecb9fb61|Calle Querétaro, Roma Norte, Cuauhtémoc, Distrito Federal|8200000 pesos|141 m² construidos,3 recs.|39|Calle Querétaro|19.39068|-99.2836995|
Oficina En Ph En Renta. 97m2 Col. Roma, Muy Cerca De Mb Álva|Oficina en renta|https://inmueble.metroscubicos.com/MLM-1353707664-oficina-en-ph-en-renta-97m2-col-roma-muy-cerca-de-mb-alva-_JM#position=40&search_layout=grid&type=item&tracking_id=077a4fe9-ef0c-4d2d-abe1-8f19ecb9fb61|Guanajuato, Roma Norte, Cuauhtémoc, Distrito Federal|22000 pesos|97 m² construidos|40|Guanajuato|19.39068|-99.2836995|
Renta Oficina Roma Norte Piso Completo|Oficina en renta|https://inmueble.metroscubicos.com/MLM-1358163195-renta-oficina-roma-norte-piso-completo-_JM#position=41&search_layout=grid&type=item&tracking_id=077a4fe9-ef0c-4d2d-abe1-8f19ecb9fb61|Roma Norte, Cuauhtémoc, Distrito Federal|55000 pesos|200 m² construidos|41||19.39068|-99.2836995|Publicado hace 55 días
Plaza Río De Janeiro Departamento Remodelado|Departamento en renta|https://departamento.metroscubicos.com/MLM-1358539178-plaza-rio-de-janeiro-departamento-remodelado-_JM#position=42&search_layout=grid&type=item&tracking_id=077a4fe9-ef0c-4d2d-abe1-8f19ecb9fb61|Plaza Río De Janeiro 53, Roma Norte, Ciudad De México, Cdmx, México, Roma Norte, Cuauhtémoc, Distrito Federal|32000 pesos|208 m² construidos,3 recs.|42|Plaza Río De Janeiro 53, Roma Norte, Ciudad De México, Cdmx, México|19.39068|-99.2836995|Publicado hace 54 días
Departamento Con Terraza Privada,  De Dos Niveles,  En Planta Baja|Departamento en venta|https://departamento.metroscubicos.com/MLM-1356469701-departamento-con-terraza-privada-de-dos-niveles-en-planta-baja-_JM#position=43&search_layout=grid&type=item&tracking_id=077a4fe9-ef0c-4d2d-abe1-8f19ecb9fb61|Jalapa 164, Roma Norte, Cuauhtémoc, Distrito Federal|4950000 pesos|99 m² construidos,2 recs.|43|Jalapa 164|19.39068|-99.2836995|Publicado hace 1 meses
Departamento En Venta En Roma Norte Con Excelente Ubicación|Departamento en venta|https://departamento.metroscubicos.com/MLM-1361683764-departamento-en-venta-en-roma-norte-con-excelente-ubicacion-_JM#position=44&search_layout=grid&type=item&tracking_id=077a4fe9-ef0c-4d2d-abe1-8f19ecb9fb61|Oaxaca, Roma Norte, Cuauhtémoc, Distrito Federal|7500000 pesos|94 m² construidos,2 recs.|44|Oaxaca|19.39068|-99.2836995|Publicado hace 43 días
Departamento En Venta En La Colonia Roma Norte|Departamento en venta|https://departamento.metroscubicos.com/MLM-924787538-departamento-en-venta-en-la-colonia-roma-norte-_JM#position=45&search_layout=grid&type=item&tracking_id=077a4fe9-ef0c-4d2d-abe1-8f19ecb9fb61|Colima 251, Roma Norte, Cuauhtémoc, Distrito Federal|5600000 pesos|90 m² construidos,2 recs.|45|Colima 251|19.39068|-99.2836995|Publicado hace 9 meses
Local Comercial Colonia Roma En Venta Ya Produciendo|Local comercial en venta|https://inmueble.metroscubicos.com/MLM-1359096392-local-comercial-colonia-roma-en-venta-ya-produciendo-_JM#position=46&search_layout=grid&type=item&tracking_id=077a4fe9-ef0c-4d2d-abe1-8f19ecb9fb61|Guanajuato 147, Roma Norte, Cuauhtémoc, Distrito Federal|9500000 pesos|136 m² construidos|46|Guanajuato 147|19.39068|-99.2836995|Publicado hace 1 año
Increíble Depto En El Corazón De La Roma|Departamento en renta|https://departamento.metroscubicos.com/MLM-1367892564-increible-depto-en-el-corazon-de-la-roma-_JM#position=47&search_layout=grid&type=item&tracking_id=077a4fe9-ef0c-4d2d-abe1-8f19ecb9fb61|San Luis Potosi  79, Roma Norte, Cuauhtémoc, Distrito Federal|22000 pesos|102 m² construidos,1 rec.|47|San Luis Potosi  79|19.39068|-99.2836995|Publicado hace 26 días
Despacho Dentro De Oficina En Renta Col Roma Norte Ubicada|Oficina en renta|https://inmueble.metroscubicos.com/MLM-1358567930-despacho-dentro-de-oficina-en-renta-col-roma-norte-ubicada-_JM#position=48&search_layout=grid&type=item&tracking_id=077a4fe9-ef0c-4d2d-abe1-8f19ecb9fb61|Morelia 38, Roma Norte, Cuauhtémoc, Distrito Federal|4700 pesos|12 m² construidos|48|Morelia 38|19.39068|-99.2836995|Publicado hace 4 años
Despacho Dentro De Oficina En Renta Col Roma Norte Ubicada|Oficina en renta|https://inmueble.metroscubicos.com/MLM-1358567930-despacho-dentro-de-oficina-en-renta-col-roma-norte-ubicada-_JM#position=1&search_layout=grid&type=item&tracking_id=1e02da61-e055-4c34-9114-129c216c9cf7|Morelia 38, Roma Norte, Cuauhtémoc, Distrito Federal|4700 pesos|12 m² construidos|49|Morelia 38|19.39068|-99.2836995|Publicado hace 4 años
Excelente Oficina En Renta En Colonia Roma, Cerca De Metrobu|Oficina en renta|https://inmueble.metroscubicos.com/MLM-1353707650-excelente-oficina-en-renta-en-colonia-roma-cerca-de-metrobu-_JM#position=2&search_layout=grid&type=item&tracking_id=1e02da61-e055-4c34-9114-129c216c9cf7|Gunajuato 224, Roma Norte, Cuauhtémoc, Distrito Federal|30000 pesos|125 m² construidos|50|Gunajuato 224|19.39068|-99.2836995|
4855 Zacatecas 3|Departamento en venta|https://departamento.metroscubicos.com/MLM-1317100563-4855-zacatecas-3-_JM#position=3&search_layout=grid&type=item&tracking_id=1e02da61-e055-4c34-9114-129c216c9cf7|Zacatecas, Roma Norte, Cuauhtémoc, Distrito Federal|4750000 pesos|70 m² construidos,1 rec.|51|Zacatecas|19.39068|-99.2836995|
Roma Norte Venta De Hermosa Casa Con Acabados De Lujo.|Casa en venta|https://casa.metroscubicos.com/MLM-1362501123-roma-norte-venta-de-hermosa-casa-con-acabados-de-lujo-_JM#position=4&search_layout=grid&type=item&tracking_id=1e02da61-e055-4c34-9114-129c216c9cf7|Cozumel Sn, Roma Norte, Cuauhtémoc, Distrito Federal|11599000 pesos|169 m² construidos,3 recs.|52|Cozumel Sn|19.39068|-99.2836995|Publicado hace 41 días
Roma. Venta Edificio. Uso Suelo Mixto. Trato Directo|Edificio en venta|https://inmueble.metroscubicos.com/MLM-1359190019-roma-venta-edificio-uso-suelo-mixto-trato-directo-_JM#position=5&search_layout=grid&type=item&tracking_id=1e02da61-e055-4c34-9114-129c216c9cf7|Tonala 121, Roma Norte, Cuauhtémoc, Distrito Federal|110000000 pesos|4,200 m² construidos|53|Tonala 121|19.39068|-99.2836995|Publicado hace 2 años
Renta Departamento Amueblado Roma Norte , Super Ubicacion |Departamento en renta|https://departamento.metroscubicos.com/MLM-1372354627-renta-departamento-amueblado-roma-norte-super-ubicacion-_JM#position=6&search_layout=grid&type=item&tracking_id=1e02da61-e055-4c34-9114-129c216c9cf7|Colima 326, Roma Norte, Ciudad De México, Cdmx, México, Roma Norte, Cuauhtémoc, Distrito Federal|26000 pesos|95 m² construidos,2 recs.|54|Colima 326, Roma Norte, Ciudad De México, Cdmx, México|19.39068|-99.2836995|Publicado hace 43 días
Depa En La Roma Norte Acepto Creditos|Departamento en venta|https://departamento.metroscubicos.com/MLM-1365056582-depa-en-la-roma-norte-acepto-creditos-_JM#position=7&search_layout=grid&type=item&tracking_id=1e02da61-e055-4c34-9114-129c216c9cf7|Zacatecas 0, Roma Norte, Cuauhtémoc, Distrito Federal|4500000 pesos|93 m² construidos,3 recs.|55|Zacatecas 0|19.39068|-99.2836995|Publicado hace 11 meses
Oficina Amueblada Roma-condesa 5,000.00 Por Mes|Oficina en renta|https://inmueble.metroscubicos.com/MLM-1370009562-oficina-amueblada-roma-condesa-500000-por-mes-_JM#position=8&search_layout=grid&type=item&tracking_id=1e02da61-e055-4c34-9114-129c216c9cf7|Medellin 107, Roma Norte, Cuauhtémoc, Distrito Federal|5000 pesos|12 m² construidos|56|Medellin 107|19.39068|-99.2836995|Publicado hace 1 año
Departamento Nuevo En Venta - Roma Norte|Departamento en venta|https://departamento.metroscubicos.com/MLM-1371045482-departamento-nuevo-en-venta-roma-norte-_JM#position=9&search_layout=grid&type=item&tracking_id=1e02da61-e055-4c34-9114-129c216c9cf7|Coahuila 10, Roma Norte, Ciudad De México, Cdmx, México, Roma Norte, Cuauhtémoc, Distrito Federal|6870431 pesos|95 m² construidos,3 recs.|57|Coahuila 10, Roma Norte, Ciudad De México, Cdmx, México|19.39068|-99.2836995|Publicado hace 18 días
Plaza Río De Janeiro En Venta Departamento Remodelado|Departamento en venta|https://departamento.metroscubicos.com/MLM-1360437554-plaza-rio-de-janeiro-en-venta-departamento-remodelado-_JM#position=10&search_layout=grid&type=item&tracking_id=1e02da61-e055-4c34-9114-129c216c9cf7|Plaza Río De Janeiro 53, Roma Norte, Ciudad De México, Cdmx, México, Roma Norte, Cuauhtémoc, Distrito Federal|13500000 pesos|208 m² construidos,3 recs.|58|Plaza Río De Janeiro 53, Roma Norte, Ciudad De México, Cdmx, México|19.39068|-99.2836995|Publicado hace 48 días
Departamento Nuevo En Venta - Roma Norte|Departamento en venta|https://departamento.metroscubicos.com/MLM-1371039581-departamento-nuevo-en-venta-roma-norte-_JM#position=11&search_layout=grid&type=item&tracking_id=1e02da61-e055-4c34-9114-129c216c9cf7|Coahuila 10, Roma Norte, Ciudad De México, Cdmx, México, Roma Norte, Cuauhtémoc, Distrito Federal|7276231 pesos|95 m² construidos,3 recs.|59|Coahuila 10, Roma Norte, Ciudad De México, Cdmx, México|19.39068|-99.2836995|Publicado hace 18 días
Roma. Oficinas En Renta|Oficina en renta|https://inmueble.metroscubicos.com/MLM-1359164118-roma-oficinas-en-renta-_JM#position=12&search_layout=grid&type=item&tracking_id=1e02da61-e055-4c34-9114-129c216c9cf7|Tonala 121, Roma Norte, Cuauhtémoc, Distrito Federal|23000 pesos|80 m² construidos|60|Tonala 121|19.39068|-99.2836995|Publicado hace 1 año
Confortable Depa En Roma Norte, Cerca De Metro Sevilla, 71465|Departamento en renta|https://departamento.metroscubicos.com/MLM-1365813778-confortable-depa-en-roma-norte-cerca-de-metro-sevilla-71465-_JM#position=13&search_layout=grid&type=item&tracking_id=1e02da61-e055-4c34-9114-129c216c9cf7|Calle Salamanca, Roma Norte, Cuauhtémoc, Distrito Federal|18500 pesos|65 m² construidos,2 recs.|61|Calle Salamanca|19.39068|-99.2836995|
