main_name|subtitle|link|location|price|attributes|id|address|lat|lon|since
Departamento En Venta Cerca Del Parque España, Condesa 2 Niv|Departamento en venta|https://departamento.metroscubicos.com/MLM-1361448831-departamento-en-venta-cerca-del-parque-espana-condesa-2-niv-_JM#position=48&search_layout=grid&type=item&tracking_id=5fe71a78-aad9-4c9f-91d4-76731aed1316|Veracruz, Roma Norte, Cuauhtémoc, Distrito Federal|11800000 pesos|149 m² construidos,2 recs.|1008|Veracruz|19.39068|-99.2836995|Publicado hace 43 días
12284 Av. Yucatan, Roma Norte|Departamento en venta|https://departamento.metroscubicos.com/MLM-1350770712-12284-av-yucatan-roma-norte-_JM#position=1&search_layout=grid&type=item&tracking_id=6b4b69ae-9d04-42a4-8d0d-443fb6f89170|Av  Yucatan, Roma Norte, Cuauhtémoc, Distrito Federal|4890000 pesos|93 m² construidos,2 recs.|1009|Av  Yucatan|19.39068|-99.2836995|
10405 Colima, Roma Norte|Departamento en venta|https://departamento.metroscubicos.com/MLM-1333348643-10405-colima-roma-norte-_JM#position=2&search_layout=grid&type=item&tracking_id=6b4b69ae-9d04-42a4-8d0d-443fb6f89170|Colima, Roma Norte, Cuauhtémoc, Distrito Federal|6900000 pesos|110 m² construidos,3 recs.|1010|Colima|19.39068|-99.2836995|
Excelente Oficina En Roma Norte, Cuauhtémoc.|Oficina en renta|https://inmueble.metroscubicos.com/MLM-1329886730-excelente-oficina-en-roma-norte-cuauhtemoc-_JM#position=3&search_layout=grid&type=item&tracking_id=6b4b69ae-9d04-42a4-8d0d-443fb6f89170|Roma Norte, Cuauhtémoc, Distrito Federal|14000 pesos|36 m² construidos|1011||19.39068|-99.2836995|Publicado hace 3 meses
Oficina En Renta, Edificio Chico|Oficina en renta|https://inmueble.metroscubicos.com/MLM-921929266-oficina-en-renta-edificio-chico-_JM#position=4&search_layout=grid&type=item&tracking_id=6b4b69ae-9d04-42a4-8d0d-443fb6f89170|Tonalá, Roma Norte, Cuauhtémoc, Distrito Federal|47000 pesos|163 m² construidos|1012|Tonalá|19.39068|-99.2836995|Publicado hace 8 meses
Departamento En Venta En Col. Roma Norte 3 Recamaras 2 Autos|Departamento en venta|https://departamento.metroscubicos.com/MLM-1370743618-departamento-en-venta-en-col-roma-norte-3-recamaras-2-autos-_JM#position=5&search_layout=grid&type=item&tracking_id=6b4b69ae-9d04-42a4-8d0d-443fb6f89170|Avenida Yucatan 65, Roma Norte, Ciudad De México, Cdmx, México, Roma Norte, Cuauhtémoc, Distrito Federal|5950000 pesos|119 m² construidos,3 recs.|1013|Avenida Yucatan 65, Roma Norte, Ciudad De México, Cdmx, México|19.39068|-99.2836995|Publicado hace 18 días
Departamento En Venta En La Calle Jalapa, Colonia Roma Norte|Departamento en venta|https://departamento.metroscubicos.com/MLM-1362974372-departamento-en-venta-en-la-calle-jalapa-colonia-roma-norte-_JM#position=6&search_layout=grid&type=item&tracking_id=6b4b69ae-9d04-42a4-8d0d-443fb6f89170|Jalapa, Roma Norte, Cuauhtémoc, Distrito Federal|5900000 pesos|150 m² construidos,3 recs.|1014|Jalapa|19.39068|-99.2836995|Publicado hace 40 días
Departamento Pent House Nuevo En Venta En Colonia Roma|Departamento en venta|https://departamento.metroscubicos.com/MLM-1325942383-departamento-pent-house-nuevo-en-venta-en-colonia-roma-_JM#position=7&search_layout=grid&type=item&tracking_id=6b4b69ae-9d04-42a4-8d0d-443fb6f89170|Puebla, Roma Norte, Cuauhtémoc, Distrito Federal|9086780 pesos|107 m² construidos,2 recs.|1015|Puebla|19.39068|-99.2836995|Publicado hace 4 meses
Departamento En Venta En Roma Norte Yucatan 2268ru|Departamento en venta|https://departamento.metroscubicos.com/MLM-1320505238-departamento-en-venta-en-roma-norte-yucatan-2268ru-_JM#position=8&search_layout=grid&type=item&tracking_id=6b4b69ae-9d04-42a4-8d0d-443fb6f89170|Roma Norte, Cuauhtémoc, Distrito Federal|3995000 pesos|85 m² construidos,2 recs.|1016||19.39068|-99.2836995|Publicado hace 4 meses
Departamento En La Roma|Departamento en venta|https://departamento.metroscubicos.com/MLM-952426008-departamento-en-la-roma-_JM#position=9&search_layout=grid&type=item&tracking_id=6b4b69ae-9d04-42a4-8d0d-443fb6f89170|Querétaro, Roma Norte, Cuauhtémoc, Distrito Federal|8500000 pesos|145 m² construidos,3 recs.|1017|Querétaro|19.39068|-99.2836995|Publicado hace 6 meses
 Departamento En Venta Cuauhtémoc Roma Norte Rt 22-3139|Departamento en venta|https://departamento.metroscubicos.com/MLM-1367133849-departamento-en-venta-cuauhtemoc-roma-norte-rt-22-3139-_JM#position=10&search_layout=grid&type=item&tracking_id=6b4b69ae-9d04-42a4-8d0d-443fb6f89170|Roma Norte, Cuauhtémoc, Distrito Federal|14654425 pesos|169 m² construidos,3 recs.|1018||19.39068|-99.2836995|Publicado hace 28 días
Penthouse En Venta En Zacatecas Cuauhtemoc Roma Norte 212447rt|Departamento en venta|https://departamento.metroscubicos.com/MLM-1320499493-penthouse-en-venta-en-zacatecas-cuauhtemoc-roma-norte-212447rt-_JM#position=11&search_layout=grid&type=item&tracking_id=6b4b69ae-9d04-42a4-8d0d-443fb6f89170|Roma Norte, Cuauhtémoc, Distrito Federal|14700000 pesos|284 m² construidos,3 recs.|1019||19.39068|-99.2836995|Publicado hace 4 meses
Departamento En Venta Roma Norte|Departamento en venta|https://departamento.metroscubicos.com/MLM-925818380-departamento-en-venta-roma-norte-_JM#position=12&search_layout=grid&type=item&tracking_id=6b4b69ae-9d04-42a4-8d0d-443fb6f89170|Valladolid0, Roma Norte, Cuauhtémoc, Distrito Federal|3425000 pesos|42 m² construidos,1 rec.|1020|Valladolid0|19.39068|-99.2836995|Publicado hace 8 meses
Departamento En Venta En Cordoba Cat214976|Departamento en venta|https://departamento.metroscubicos.com/MLM-1351597584-departamento-en-venta-en-cordoba-cat214976-_JM#position=13&search_layout=grid&type=item&tracking_id=6b4b69ae-9d04-42a4-8d0d-443fb6f89170|Roma Norte, Cuauhtémoc, Distrito Federal|4495000 pesos|86 m² construidos,3 recs.|1021||19.39068|-99.2836995|Publicado hace 2 meses
Renta Local O  Bodega Roma Norte Cuauhtémoc|Local comercial en renta|https://inmueble.metroscubicos.com/MLM-1346979136-renta-local-o-bodega-roma-norte-cuauhtemoc-_JM#position=14&search_layout=grid&type=item&tracking_id=6b4b69ae-9d04-42a4-8d0d-443fb6f89170|Roma Norte, Cuauhtémoc, Distrito Federal|350 pesos|545 m² construidos|1022||19.39068|-99.2836995|Publicado hace 2 meses
Terreno Ortogonal Para Desarrollar En La Roma Norte|Terreno en venta|https://terreno.metroscubicos.com/MLM-916755716-terreno-ortogonal-para-desarrollar-en-la-roma-norte-_JM#position=15&search_layout=grid&type=item&tracking_id=6b4b69ae-9d04-42a4-8d0d-443fb6f89170|Orizaba, Roma Norte, Cuauhtémoc, Distrito Federal|66000000 pesos|1 m² construidos|1023|Orizaba|19.39068|-99.2836995|Publicado hace 9 meses
Departamento En Venta Con Terraza En La Roma Norte|Departamento en venta|https://departamento.metroscubicos.com/MLM-1330183717-departamento-en-venta-con-terraza-en-la-roma-norte-_JM#position=16&search_layout=grid&type=item&tracking_id=6b4b69ae-9d04-42a4-8d0d-443fb6f89170|Av. Chapultepec, Roma Norte, Cuauhtémoc, Distrito Federal|4595000 pesos|85 m² construidos,2 recs.|1024|Av. Chapultepec|19.39068|-99.2836995|Publicado hace 3 meses
Lofts Y Departamentos De Lujo Una Y Dos Recamaras|Departamento en venta|https://departamento.metroscubicos.com/MLM-889946108-lofts-y-departamentos-de-lujo-una-y-dos-recamaras-_JM#position=17&search_layout=grid&type=item&tracking_id=6b4b69ae-9d04-42a4-8d0d-443fb6f89170|Roma Norte, Cuauhtémoc, Distrito Federal|4050000 pesos|57 m² construidos,2 recs.|1025||19.39068|-99.2836995|Publicado hace 11 meses
D649 - Sinaloa, Roma Norte|Departamento en venta|https://departamento.metroscubicos.com/MLM-1316995439-d649-sinaloa-roma-norte-_JM#position=18&search_layout=grid&type=item&tracking_id=6b4b69ae-9d04-42a4-8d0d-443fb6f89170|Sinaloa, Roma Norte, Cuauhtémoc, Distrito Federal|6820000 pesos|103 m² construidos,2 recs.|1026|Sinaloa|19.39068|-99.2836995|
Oficina En Renta En Colonia Roma Norte, Oficina En Renta De 50 M² En Alcaldia Cuahutemoc, En Avenida|Oficina en renta|https://inmueble.metroscubicos.com/MLM-1373408713-oficina-en-renta-en-colonia-roma-norte-oficina-en-renta-de-50-m-en-alcaldia-cuahutemoc-en-avenida-_JM#position=19&search_layout=grid&type=item&tracking_id=6b4b69ae-9d04-42a4-8d0d-443fb6f89170|Roma Norte, Cuauhtémoc, Distrito Federal|15000 pesos|50 m² construidos|1027||19.39068|-99.2836995|Publicado hace 12 días
Renta Oficinas Colonia Roma|Oficina en renta|https://inmueble.metroscubicos.com/MLM-1346979128-renta-oficinas-colonia-roma-_JM#position=20&search_layout=grid&type=item&tracking_id=6b4b69ae-9d04-42a4-8d0d-443fb6f89170|Roma Norte, Cuauhtémoc, Distrito Federal|32000 pesos|1 m² construidos|1028||19.39068|-99.2836995|Publicado hace 2 meses
Exclusivo Desarrollo En Preventa Colonia Roma Con Espacios Amplios Y Luminosos Entrega Mediados 2022|Departamento en venta|https://departamento.metroscubicos.com/MLM-1336895262-exclusivo-desarrollo-en-preventa-colonia-roma-con-espacios-amplios-y-luminosos-entrega-mediados-2022-_JM#position=21&search_layout=grid&type=item&tracking_id=6b4b69ae-9d04-42a4-8d0d-443fb6f89170|Coahuila 28, Roma Norte, Cuauhtémoc, Distrito Federal|7245000 pesos|76 m² construidos,2 recs.|1029|Coahuila 28|19.39068|-99.2836995|Publicado hace 3 meses
Excelente Pent House En Venta En Roma Norte|Departamento en venta|https://departamento.metroscubicos.com/MLM-1330093240-excelente-pent-house-en-venta-en-roma-norte-_JM#position=22&search_layout=grid&type=item&tracking_id=6b4b69ae-9d04-42a4-8d0d-443fb6f89170|Guanajuato, Roma Norte, Cuauhtémoc, Distrito Federal|9350000 pesos|117 m² construidos,2 recs.|1030|Guanajuato|19.39068|-99.2836995|Publicado hace 3 meses
Departamento En Venta Cuauhtémoc, Roma Norte Gis.|Departamento en venta|https://departamento.metroscubicos.com/MLM-1320537070-departamento-en-venta-cuauhtemoc-roma-norte-gis-_JM#position=23&search_layout=grid&type=item&tracking_id=6b4b69ae-9d04-42a4-8d0d-443fb6f89170|Roma Norte, Cuauhtémoc, Distrito Federal|6500000 pesos|75 m² construidos,1 rec.|1031||19.39068|-99.2836995|Publicado hace 4 meses
Departamento En Venta Cuauhtémoc Roma Norte Gis|Departamento en venta|https://departamento.metroscubicos.com/MLM-1320537067-departamento-en-venta-cuauhtemoc-roma-norte-gis-_JM#position=24&search_layout=grid&type=item&tracking_id=6b4b69ae-9d04-42a4-8d0d-443fb6f89170|Roma Norte, Cuauhtémoc, Distrito Federal|4780000 pesos|74 m² construidos,1 rec.|1032||19.39068|-99.2836995|Publicado hace 4 meses
Departamento En Venta Roma Norte Cuauhtémoc Rt 22-3138|Departamento en venta|https://departamento.metroscubicos.com/MLM-1367183127-departamento-en-venta-roma-norte-cuauhtemoc-rt-22-3138-_JM#position=25&search_layout=grid&type=item&tracking_id=6b4b69ae-9d04-42a4-8d0d-443fb6f89170|Roma Norte, Cuauhtémoc, Distrito Federal|12843080 pesos|160 m² construidos,3 recs.|1033||19.39068|-99.2836995|Publicado hace 28 días
Departamento En Venta En Cuauhtémoc, Roma Norte.  E.c|Departamento en venta|https://departamento.metroscubicos.com/MLM-1333411299-departamento-en-venta-en-cuauhtemoc-roma-norte-ec-_JM#position=26&search_layout=grid&type=item&tracking_id=6b4b69ae-9d04-42a4-8d0d-443fb6f89170|Roma Norte, Cuauhtémoc, Distrito Federal|4495003 pesos|86 m² construidos,3 recs.|1034||19.39068|-99.2836995|Publicado hace 3 meses
Oficinas Virtuales Roma Norte|Oficina en renta|https://inmueble.metroscubicos.com/MLM-916759475-oficinas-virtuales-roma-norte-_JM#position=27&search_layout=grid&type=item&tracking_id=6b4b69ae-9d04-42a4-8d0d-443fb6f89170|Av Chapultepec, Roma Norte, Cuauhtémoc, Distrito Federal|14500 pesos|1 m² construidos|1035|Av Chapultepec|19.39068|-99.2836995|Publicado hace 9 meses
Local Comercial En Renta, Cuauhtémoc, Ciudad De México|Local comercial en renta|https://inmueble.metroscubicos.com/MLM-1370924741-local-comercial-en-renta-cuauhtemoc-ciudad-de-mexico-_JM#position=28&search_layout=grid&type=item&tracking_id=6b4b69ae-9d04-42a4-8d0d-443fb6f89170|Colima, Roma Norte, Cuauhtémoc, Distrito Federal|256891 pesos|338 m² construidos|1036|Colima|19.39068|-99.2836995|Publicado hace 18 días
Oficina En Renta En Roma Norte  Ff  22 - 2255 - 1|Oficina en renta|https://inmueble.metroscubicos.com/MLM-1366654064-oficina-en-renta-en-roma-norte-ff-22-2255-1-_JM#position=29&search_layout=grid&type=item&tracking_id=6b4b69ae-9d04-42a4-8d0d-443fb6f89170|Roma Norte, Cuauhtémoc, Distrito Federal|105000 pesos|340 m² construidos|1037||19.39068|-99.2836995|Publicado hace 29 días
Departamento Venta En Roma Norte|Departamento en venta|https://departamento.metroscubicos.com/MLM-1352281159-departamento-venta-en-roma-norte-_JM#position=30&search_layout=grid&type=item&tracking_id=6b4b69ae-9d04-42a4-8d0d-443fb6f89170|Avenida Chapultepec, Roma Norte, Cuauhtémoc, Distrito Federal|4750000 pesos|70 m² construidos,2 recs.|1038|Avenida Chapultepec|19.39068|-99.2836995|Publicado hace 2 meses
Departamento En Roma Norte|Departamento en venta|https://departamento.metroscubicos.com/MLM-1348409544-departamento-en-roma-norte-_JM#position=31&search_layout=grid&type=item&tracking_id=6b4b69ae-9d04-42a4-8d0d-443fb6f89170|Cuauhtémoc, Distrito Federal|3840000 pesos|80 m² construidos,3 recs.|1039||19.39068|-99.2836995|Publicado hace 2 meses
Colonia Roma Se Vende  Departamento Nuevo|Departamento en venta|https://departamento.metroscubicos.com/MLM-1344653130-colonia-roma-se-vende-departamento-nuevo-_JM#position=32&search_layout=grid&type=item&tracking_id=6b4b69ae-9d04-42a4-8d0d-443fb6f89170|Roma Norte, Cuauhtémoc, Distrito Federal|5436000 pesos|70 m² construidos,2 recs.|1040||19.39068|-99.2836995|Publicado hace 2 meses
Departamento En Venta Cuauhtémoc Roma Norte Gis.|Departamento en venta|https://departamento.metroscubicos.com/MLM-1320577541-departamento-en-venta-cuauhtemoc-roma-norte-gis-_JM#position=33&search_layout=grid&type=item&tracking_id=6b4b69ae-9d04-42a4-8d0d-443fb6f89170|Roma Norte, Cuauhtémoc, Distrito Federal|4364000 pesos|69 m² construidos,1 rec.|1041||19.39068|-99.2836995|Publicado hace 4 meses
Departamento En Venta En Roma Norte, Cuauhtémoc, Distrito Federal|Departamento en venta|https://departamento.metroscubicos.com/MLM-907487287-departamento-en-venta-en-roma-norte-cuauhtemoc-distrito-federal-_JM#position=34&search_layout=grid&type=item&tracking_id=6b4b69ae-9d04-42a4-8d0d-443fb6f89170|Roma Norte, Cuauhtémoc, Distrito Federal|8250000 pesos|167 m² construidos,2 recs.|1042||19.39068|-99.2836995|Publicado hace 9 meses
Departamento En Venta En Roma Norte 221081me|Departamento en venta|https://departamento.metroscubicos.com/MLM-1330357830-departamento-en-venta-en-roma-norte-221081me-_JM#position=35&search_layout=grid&type=item&tracking_id=6b4b69ae-9d04-42a4-8d0d-443fb6f89170|Roma Norte, Cuauhtémoc, Distrito Federal|2595000 pesos|42 m² construidos,1 rec.|1043||19.39068|-99.2836995|Publicado hace 3 meses
Fabuloso Edificio En Renta En Roma Norte|Casa en renta|https://casa.metroscubicos.com/MLM-1308603575-fabuloso-edificio-en-renta-en-roma-norte-_JM#position=36&search_layout=grid&type=item&tracking_id=6b4b69ae-9d04-42a4-8d0d-443fb6f89170|Roma Norte, Cuauhtémoc, Distrito Federal|399031 pesos|1,146 m² construidos|1044||19.39068|-99.2836995|Publicado hace 5 meses
Álvaro Obregón, Roma Norte|Departamento en venta|https://departamento.metroscubicos.com/MLM-962499229-alvaro-obregon-roma-norte-_JM#position=37&search_layout=grid&type=item&tracking_id=6b4b69ae-9d04-42a4-8d0d-443fb6f89170|Roma Norte, Cuauhtémoc, Distrito Federal|3029711 pesos|31 m² construidos,1 rec.|1045||19.39068|-99.2836995|Publicado hace 5 meses
Oficina En Renta Roma Norte|Oficina en renta|https://inmueble.metroscubicos.com/MLM-916385358-oficina-en-renta-roma-norte-_JM#position=38&search_layout=grid&type=item&tracking_id=6b4b69ae-9d04-42a4-8d0d-443fb6f89170|Córdoba, Roma Norte, Cuauhtémoc, Distrito Federal|25000 pesos|85 m² construidos|1046|Córdoba|19.39068|-99.2836995|Publicado hace 9 meses
Roma Norte, Proyecto Del Arq. Antonio Farré, Mural De Marco |Departamento en venta|https://departamento.metroscubicos.com/MLM-841991441-roma-norte-proyecto-del-arq-antonio-farre-mural-de-marco-_JM#position=39&search_layout=grid&type=item&tracking_id=6b4b69ae-9d04-42a4-8d0d-443fb6f89170|Chiapas, Roma Norte, Cuauhtémoc, Distrito Federal|5500000 pesos|58 m² construidos,1 rec.|1047|Chiapas|19.39068|-99.2836995|
Oficina Amueblada De 600 M2 En Roma Norte A 2 Calles Metro C|Oficina en renta|https://inmueble.metroscubicos.com/MLM-1353752995-oficina-amueblada-de-600-m2-en-roma-norte-a-2-calles-metro-c-_JM#position=40&search_layout=grid&type=item&tracking_id=6b4b69ae-9d04-42a4-8d0d-443fb6f89170|Roma Norte, Cuauhtémoc, Distrito Federal|150000 pesos|600 m² construidos|1048||19.39068|-99.2836995|
Oficina Amueblada De 600 M2 En Roma Norte A 2 Calles Metro C|Oficina en venta|https://inmueble.metroscubicos.com/MLM-1353727120-oficina-amueblada-de-600-m2-en-roma-norte-a-2-calles-metro-c-_JM#position=41&search_layout=grid&type=item&tracking_id=6b4b69ae-9d04-42a4-8d0d-443fb6f89170|Roma Norte, Cuauhtémoc, Distrito Federal|22000000 pesos|600 m² construidos|1049||19.39068|-99.2836995|
Excelente Oportunidad Para Oficinas Roma Norte|Oficina en renta|https://inmueble.metroscubicos.com/MLM-1349296848-excelente-oportunidad-para-oficinas-roma-norte-_JM#position=42&search_layout=grid&type=item&tracking_id=6b4b69ae-9d04-42a4-8d0d-443fb6f89170|Av. De Los Insurgentes Centro, Roma Norte, Cuauhtémoc, Distrito Federal|85000 pesos|436 m² construidos|1050|Av. De Los Insurgentes Centro|19.39068|-99.2836995|Publicado hace 2 meses
12056 Av. Cuauhtémoc, Roma Norte|Departamento en venta|https://departamento.metroscubicos.com/MLM-1348882006-12056-av-cuauhtemoc-roma-norte-_JM#position=43&search_layout=grid&type=item&tracking_id=6b4b69ae-9d04-42a4-8d0d-443fb6f89170|Av  Cuauhtémoc, Roma Norte, Cuauhtémoc, Distrito Federal|5200000 pesos|117 m² construidos,2 recs.|1051|Av  Cuauhtémoc|19.39068|-99.2836995|
Oficina En Renta En Cuauhtémoc, Roma Norte. E.c  |Oficina en renta|https://inmueble.metroscubicos.com/MLM-1331398623-oficina-en-renta-en-cuauhtemoc-roma-norte-ec-_JM#position=44&search_layout=grid&type=item&tracking_id=6b4b69ae-9d04-42a4-8d0d-443fb6f89170|Roma Norte, Cuauhtémoc, Distrito Federal|105003 pesos|340 m² construidos|1052||19.39068|-99.2836995|Publicado hace 3 meses
Oficina En Renta En Cuauhtémoc, Roma Norte. E.c |Oficina en renta|https://inmueble.metroscubicos.com/MLM-1328758120-oficina-en-renta-en-cuauhtemoc-roma-norte-ec-_JM#position=45&search_layout=grid&type=item&tracking_id=6b4b69ae-9d04-42a4-8d0d-443fb6f89170|Roma Norte, Cuauhtémoc, Distrito Federal|61603 pesos|200 m² construidos|1053||19.39068|-99.2836995|Publicado hace 3 meses
Oficina En Renta Roma Norte, Avenida Alvaro Obregon. Mls #21-1890 Rk|Oficina en renta|https://inmueble.metroscubicos.com/MLM-1320479083-oficina-en-renta-roma-norte-avenida-alvaro-obregon-mls-21-1890-rk-_JM#position=46&search_layout=grid&type=item&tracking_id=6b4b69ae-9d04-42a4-8d0d-443fb6f89170|Roma Norte, Cuauhtémoc, Distrito Federal|61600 pesos|200 m² construidos|1054||19.39068|-99.2836995|Publicado hace 4 meses
Oficina En Renta Roma Norte, Avenida Alvaro Obregon. Mls #21-1893 Rk|Oficina en renta|https://inmueble.metroscubicos.com/MLM-1320523909-oficina-en-renta-roma-norte-avenida-alvaro-obregon-mls-21-1893-rk-_JM#position=47&search_layout=grid&type=item&tracking_id=6b4b69ae-9d04-42a4-8d0d-443fb6f89170|Roma Norte, Cuauhtémoc, Distrito Federal|105000 pesos|340 m² construidos|1055||19.39068|-99.2836995|Publicado hace 4 meses
Oficina En Renta En Piso 6, Roma Norte, Cuauhtémoc|Oficina en renta|https://inmueble.metroscubicos.com/MLM-924745684-oficina-en-renta-en-piso-6-roma-norte-cuauhtemoc-_JM#position=48&search_layout=grid&type=item&tracking_id=6b4b69ae-9d04-42a4-8d0d-443fb6f89170|Roma Norte, Cuauhtémoc, Distrito Federal|53630 pesos|173 m² construidos|1056||19.39068|-99.2836995|Publicado hace 8 meses
Oficina Acondicionada  De 347 M2 En Roma Norte|Oficina en renta|https://inmueble.metroscubicos.com/MLM-949430716-oficina-acondicionada-de-347-m2-en-roma-norte-_JM#position=1&search_layout=grid&type=item&tracking_id=d2c6dae1-206a-451f-b88c-af5f5d8be3f4|Guaymas, Roma Norte, Cuauhtémoc, Distrito Federal|199781 pesos|347 m² construidos|1057|Guaymas|19.39068|-99.2836995|Publicado hace 9 meses
Oficina Comercial En Renta Roma Norte|Oficina en renta|https://inmueble.metroscubicos.com/MLM-1369328882-oficina-comercial-en-renta-roma-norte-_JM#position=2&search_layout=grid&type=item&tracking_id=d2c6dae1-206a-451f-b88c-af5f5d8be3f4|Snsn, Roma Norte, Cuauhtémoc, Distrito Federal|23000 pesos|485 m² construidos|1058|Snsn|19.39068|-99.2836995|Publicado hace 21 días
Departamento En  Roma Norte|Departamento en venta|https://departamento.metroscubicos.com/MLM-1362459575-departamento-en-roma-norte-_JM#position=3&search_layout=grid&type=item&tracking_id=d2c6dae1-206a-451f-b88c-af5f5d8be3f4|Roma Norte, Cuauhtémoc, Distrito Federal|6500000 pesos|85 m² construidos,2 recs.|1059||19.39068|-99.2836995|Publicado hace 41 días
Departamento En Venta Roma Norte, Calle Zacatecas 21-2447.  Nc|Departamento en venta|https://departamento.metroscubicos.com/MLM-1341629935-departamento-en-venta-roma-norte-calle-zacatecas-21-2447-nc-_JM#position=4&search_layout=grid&type=item&tracking_id=d2c6dae1-206a-451f-b88c-af5f5d8be3f4|Roma Norte, Cuauhtémoc, Distrito Federal|12900005 pesos|284 m² construidos,3 recs.|1060||19.39068|-99.2836995|Publicado hace 2 meses
Edificio En Roma Norte, Cuauhtémoc|Edificio en renta|https://inmueble.metroscubicos.com/MLM-1330112354-edificio-en-roma-norte-cuauhtemoc-_JM#position=5&search_layout=grid&type=item&tracking_id=d2c6dae1-206a-451f-b88c-af5f5d8be3f4|Colima, Roma Norte, Cuauhtémoc, Distrito Federal|350 pesos|1,146 m² construidos|1061|Colima|19.39068|-99.2836995|Publicado hace 3 meses
Veracruz, Roma Norte|Departamento en venta|https://departamento.metroscubicos.com/MLM-962538900-veracruz-roma-norte-_JM#position=6&search_layout=grid&type=item&tracking_id=d2c6dae1-206a-451f-b88c-af5f5d8be3f4|Veracruz, Roma Norte, Cuauhtémoc, Distrito Federal|5420077 pesos|58 m² construidos,1 rec.|1062|Veracruz|19.39068|-99.2836995|Publicado hace 5 meses
Oficinas En Renta Para Estrenar En Yama Centro/insurgentes/reforma|Oficina en renta|https://inmueble.metroscubicos.com/MLM-1375809919-oficinas-en-renta-para-estrenar-en-yama-centroinsurgentesreforma-_JM#position=7&search_layout=grid&type=item&tracking_id=d2c6dae1-206a-451f-b88c-af5f5d8be3f4|Avenida Insurgentes Sur, Roma Norte, Cuauhtémoc, Distrito Federal|22500 pesos|71 m² construidos|1063|Avenida Insurgentes Sur|19.39068|-99.2836995|Publicado hace 7 días
Departamento En Venta En Roma Norte 214976nc|Departamento en venta|https://departamento.metroscubicos.com/MLM-1320498469-departamento-en-venta-en-roma-norte-214976nc-_JM#position=8&search_layout=grid&type=item&tracking_id=d2c6dae1-206a-451f-b88c-af5f5d8be3f4|Roma Norte, Cuauhtémoc, Distrito Federal|4495000 pesos|86 m² construidos,3 recs.|1064||19.39068|-99.2836995|Publicado hace 4 meses
Go Liquidacion Dpto Aguascalientes Roma Nte Cdmx Solo Efecti|Departamento en venta|https://departamento.metroscubicos.com/MLM-1346280897-go-liquidacion-dpto-aguascalientes-roma-nte-cdmx-solo-efecti-_JM#position=9&search_layout=grid&type=item&tracking_id=d2c6dae1-206a-451f-b88c-af5f5d8be3f4|Aguascalientes   163, Roma Norte, Cuauhtémoc, Distrito Federal|3821000 pesos|65 m² construidos,2 recs.|1065|Aguascalientes   163|19.39068|-99.2836995|Publicado hace 2 meses
Departamento En Venta Roma Norte|Departamento en venta|https://departamento.metroscubicos.com/MLM-1339257496-departamento-en-venta-roma-norte-_JM#position=10&search_layout=grid&type=item&tracking_id=d2c6dae1-206a-451f-b88c-af5f5d8be3f4|Valladolid0, Roma Norte, Cuauhtémoc, Distrito Federal|3425000 pesos|42 m² construidos,1 rec.|1066|Valladolid0|19.39068|-99.2836995|Publicado hace 3 meses
Departamento En Venta En La Roma|Departamento en venta|https://departamento.metroscubicos.com/MLM-1325923009-departamento-en-venta-en-la-roma-_JM#position=11&search_layout=grid&type=item&tracking_id=d2c6dae1-206a-451f-b88c-af5f5d8be3f4|Cordoba, Roma Norte, Cuauhtémoc, Distrito Federal|4495000 pesos|86 m² construidos,3 recs.|1067|Cordoba|19.39068|-99.2836995|Publicado hace 4 meses
Departamento En Venta En Roma Norte Zacatecas 211889ru|Departamento en venta|https://departamento.metroscubicos.com/MLM-1320498618-departamento-en-venta-en-roma-norte-zacatecas-211889ru-_JM#position=12&search_layout=grid&type=item&tracking_id=d2c6dae1-206a-451f-b88c-af5f5d8be3f4|Roma Norte, Cuauhtémoc, Distrito Federal|4250000 pesos|67 m² construidos,1 rec.|1068||19.39068|-99.2836995|Publicado hace 4 meses
Departamento En Venta Roma Norte|Departamento en venta|https://departamento.metroscubicos.com/MLM-1304663924-departamento-en-venta-roma-norte-_JM#position=13&search_layout=grid&type=item&tracking_id=d2c6dae1-206a-451f-b88c-af5f5d8be3f4|Cordoba, Roma Norte, Cuauhtémoc, Distrito Federal|4495000 pesos|86 m² construidos,3 recs.|1069|Cordoba|19.39068|-99.2836995|Publicado hace 5 meses
Oficina Amueblada  De 116 M2 En Roma Norte|Oficina en renta|https://inmueble.metroscubicos.com/MLM-949429142-oficina-amueblada-de-116-m2-en-roma-norte-_JM#position=14&search_layout=grid&type=item&tracking_id=d2c6dae1-206a-451f-b88c-af5f5d8be3f4|San Luis Potosi, Roma Norte, Cuauhtémoc, Distrito Federal|46281 pesos|116 m² construidos|1070|San Luis Potosi|19.39068|-99.2836995|Publicado hace 9 meses
Departamento En Venta En San Luis Potosí 78, Roma Norte. Six1|Departamento en venta|https://departamento.metroscubicos.com/MLM-1365790316-departamento-en-venta-en-san-luis-potosi-78-roma-norte-six1-_JM#position=15&search_layout=grid&type=item&tracking_id=d2c6dae1-206a-451f-b88c-af5f5d8be3f4|San Luis Potosí 78, Roma Norte, Ciudad De México, Cdmx, México, Roma Norte, Cuauhtémoc, Distrito Federal|6500000 pesos|114 m² construidos,3 recs.|1071|San Luis Potosí 78, Roma Norte, Ciudad De México, Cdmx, México|19.39068|-99.2836995|Publicado hace 32 días
